person_id,body_id,body_name,member_type,title,start_date,end_date
18,9,BOARD OF PUBLIC WORKS,Member,,2002-05-21,2007-04-16
18,10,COMMON COUNCIL ORGANIZATIONAL COMMITTEE (ended 4/2017),Member,,2004-04-20,2005-04-19
18,4,BOARD OF ESTIMATES (ended 4/2017),Member,,2005-04-20,2006-04-17
18,170,WARNER PARK COMMUNITY RECREATION CENTER ADVISORY COM (prior to 11-7-2006).,Member,,2001-04-17,2006-11-07
18,42,COMMUNITY SERVICES COMMITTEE (ended 3/2025),Member,,2001-04-17,2007-04-16
18,158,PESTICIDE USE POLICY - AD HOC TASK FORCE ON (prior to 6-2004),Member,,2004-07-01,2004-07-08
18,59,SENIOR CITIZENS ADVISORY COMMITTEE (ended 5/2012),Member,,2001-04-17,2007-04-16
18,3,PLAN COMMISSION,Member,,2003-05-01,2005-04-30
18,10,COMMON COUNCIL ORGANIZATIONAL COMMITTEE (ended 4/2017),Member,,2005-05-03,2006-04-17
18,10,COMMON COUNCIL ORGANIZATIONAL COMMITTEE (ended 4/2017),Member,,2006-05-02,2006-09-18
18,10,COMMON COUNCIL ORGANIZATIONAL COMMITTEE (ended 4/2017),Member,,2006-09-19,2007-04-16
18,219,WARNER PARK STADIUM RENOVATION AD HOC COMMITTEE (prior to 2-21-2007),Member,,2006-10-16,2007-03-26
18,224,WARNER PARK COMMUNITY RECREATION CENTER ADVISORY SUBCOMMITTEE (ended 3-2023),Member,,2006-11-08,2007-04-16
18,200,NORTH MENDOTA PARKWAY IMPLEMENTATION OVERSIGHT COMMITTEE (Dane County) (ended 5/2013),Member,,2007-07-03,2111-11-11
18,200,NORTH MENDOTA PARKWAY IMPLEMENTATION OVERSIGHT COMMITTEE (Dane County) (ended 5/2013),Member,,2005-10-18,2007-04-17
18,59,SENIOR CITIZENS ADVISORY COMMITTEE (ended 5/2012),Member,,2007-07-03,2012-05-01
18,42,COMMUNITY SERVICES COMMITTEE (ended 3/2025),Member,Mr.,2007-11-20,2009-02-23
18,224,WARNER PARK COMMUNITY RECREATION CENTER ADVISORY SUBCOMMITTEE (ended 3-2023),Member,,2008-05-06,2014-01-06
18,245,NORTHPORT-WARNER PARK-SHERMAN NEIGHBORHOOD STEERING COMMITTEE (ended 11/2010),Member,,2008-09-16,2010-11-30
18,42,COMMUNITY SERVICES COMMITTEE (ended 3/2025),Member,,2009-02-24,2012-05-01
18,42,COMMUNITY SERVICES COMMITTEE (ended 3/2025),Member,Community Representative,2012-06-19,2016-02-29
63,169,VERONA ROAD/WEST BELTLINE HIGHWAY ADVISORY COMMITTEE (prior to 3-7-2005),Member,,2004-10-05,2005-03-07
63,161,SECTION 8 ADVISORY COMMITTEE (prior to 5-4-2006),Member,,2004-10-19,2005-04-19
63,103,BOARD OF EDUCATION - COMMON COUNCIL LIAISON COMMITTEE (prior to 6/12/2012),Member,,2004-10-05,2005-04-19
64,159,REGENT/PARK EXPANDED TID 26 AFFORDABLE HOUSING SET-ASIDE COMMITTEE (prior to 4-5-2007),Member,,2004-09-21,2005-04-19
64,137,CDA HOUSING OPERATIONS SUBCOMMITTEE (prior to 9-15-2009),Member,,2004-10-19,2005-04-19
64,107,MADISON HOUSING AUTHORITY,Member,,2004-09-20,2005-04-19
64,50,HOUSING COMMITTEE (ended 6/2012),Member,,2004-07-20,2005-04-15
64,128,SOUTH MADISON HEALTH AND FAMILY CENTER-HARAMBEE (ended 3/2011),Member,,2004-10-19,2005-04-19
64,172,WINGRA CREEK BUILD ADVISORY PROJECT TEAM (prior to 1-2-2006),Member,,2004-09-21,2005-04-19
64,132,ZOO COMMISSION - HENRY VILAS,Member,,2004-09-21,2005-04-19
64,91,COMMUNITY DEVELOPMENT AUTHORITY,Member,,2004-10-19,2005-04-19
64,152,JOINT SOUTHEAST CAMPUS AREA COMMITTEE (ended 3/2018),Member,,2004-09-21,2005-04-19
64,153,JOINT WEST CAMPUS AREA COMMITTEE (ended 3/2018),,,2004-09-21,2005-04-19
64,113,BAYVIEW FOUNDATION BOARD,Member,,2005-02-22,2005-04-19
64,196,CDA LONG RANGE PLANNING SUBCOMMITTEE (prior to 4-2-2009),Member,,2005-07-19,2009-03-03
64,225,REGENT STREET-SOUTH CAMPUS PLAN STEERING COMMITTEE (prior to 7-1-2008),Member,,2007-01-02,2008-07-01
64,264,CDA HOUSING OPERATIONS SUBCOMMITTEE,Member,,2009-09-24,2013-09-02
2,10,COMMON COUNCIL ORGANIZATIONAL COMMITTEE (ended 4/2017),Member,,2002-05-07,2004-04-19
2,3,PLAN COMMISSION,Member,,2003-05-01,2007-04-30
2,10,COMMON COUNCIL ORGANIZATIONAL COMMITTEE (ended 4/2017),Chair,,2004-04-20,2005-04-19
2,165,STATE STREET DESIGN PROJECT OVERSIGHT COMMITTEE (ended 12/12/2013),Member,,2002-05-21,2009-04-20
2,161,SECTION 8 ADVISORY COMMITTEE (prior to 5-4-2006),Member,,2005-04-20,2007-04-17
2,155,MID-STATE STREET PARKING RAMP COMMITTEE (prior to 11-15-2004),Member,,2002-09-03,2004-11-15
2,152,JOINT SOUTHEAST CAMPUS AREA COMMITTEE (ended 3/2018),Member,,2002-11-19,2005-04-30
2,141,EAST WASHINGTON AVENUE DESIGN OVERSIGHT COMMITTEE (prior to 1-19-2007),Member,,2002-09-03,2007-01-19
2,133,ALCOHOL AND OTHER DRUGS POLICY COMMITTEE (prior to 3-21-2006),Member,,2004-10-19,2006-03-21
2,177,BOARD OF ESTIMATES TIF SUBCOMMITTEE,Member,,2005-01-01,2006-09-28
2,142,EAST WASHINGTON/CAPITOL GATEWAY BUILD STEERING COMMITTEE(prior to 01/20/2010) ,Member,,2004-11-09,2009-04-20
2,53,LONG RANGE TRANSPORTATION PLANNING COMMITTEE (ended 6/2018),Member,,2003-07-15,2007-04-30
2,178,STREETCAR STUDY COMMITTEE (prior to 11-21-2007),Member,,2005-02-01,2005-04-27
2,16,TRANSIT AND PARKING COMMISSION (ended 06/2018),Member,,2001-04-17,2005-04-19
2,4,BOARD OF ESTIMATES (ended 4/2017),Member,,2004-04-20,2005-04-19
2,10,COMMON COUNCIL ORGANIZATIONAL COMMITTEE (ended 4/2017),Member,,2005-05-03,2006-04-18
2,45,EARLY CHILDHOOD CARE AND EDUCATION COMMITTEE,Member,,2006-02-21,2009-04-20
2,10,COMMON COUNCIL ORGANIZATIONAL COMMITTEE (ended 4/2017),Member,,2006-05-02,2009-04-20
2,208,INCLUSIONARY ZONING ADVISORY OVERSIGHT COMMITTEE (prior to 4-18-2009),Member,,2006-08-01,2007-04-30
2,216,TAX INCREMENTAL FINANCING POLICY AD HOC COMMITTEE,Member,,2006-10-17,2007-04-30
2,50,HOUSING COMMITTEE (ended 6/2012),Member,,2007-04-17,2009-04-20
2,232,JAMES MADISON PARK PROPERTY PLANNING COMMITTEE (work completed 1-14-2009),Member,,2007-04-17,2009-01-15
2,52,LANDMARKS COMMISSION,Member,,2007-04-17,2009-04-20
2,208,INCLUSIONARY ZONING ADVISORY OVERSIGHT COMMITTEE (prior to 4-18-2009),Member,,2007-05-01,2009-04-18
2,216,TAX INCREMENTAL FINANCING POLICY AD HOC COMMITTEE,Member,,2007-05-01,2009-03-31
2,199,LANDLORD AND TENANT ISSUES SUBCOMMITTEE (ended 6/2012),Member,,2007-04-19,2009-04-20
2,14,PUBLIC SAFETY REVIEW COMMITTEE,Member,Mayor or Designee,2019-08-06,2023-07-18
3,56,MONONA TERRACE COMMUNITY AND CONVENTION CENTER BOARD,Member,,1997-04-15,2010-08-01
3,167,TRANSPORT 2020 IMPLEMENTATION TASK FORCE (ended 12/2017),Member,,2003-08-05,2006-05-11
3,150,ICE ARENA AD HOC COMMITTEE (prior to 1-18-2005),Member,,2002-11-19,2005-01-18
3,146,GOLF SUBCOMMITTEE (ended 3-2023),Member,,2005-01-01,2023-03-31
3,177,BOARD OF ESTIMATES TIF SUBCOMMITTEE,Member,,2005-01-01,2006-09-28
3,54,MADISON CULTURAL ARTS DISTRICT BOARD,Member,,2002-11-05,2005-04-19
3,5,ALCOHOL LICENSE REVIEW COMMITTEE,Member,,2003-10-01,2005-04-19
3,4,BOARD OF ESTIMATES (ended 4/2017),Member,,1989-04-18,2005-04-19
3,209,MADISON ELECTION ADVISORY COMMITTEE (Ended 7/2014),Member,,2006-08-01,2008-02-13
3,36,WATER UTILITY BOARD,Member,,2007-09-18,2008-02-13
3,273,OVERTURE AD HOC COMMITTEE (ended 12/2010),Member,,2010-08-03,2010-12-31
3,277,REAPPORTIONMENT & REDISTRICTING AD HOC COMMITTEE (ended 8/2011),Member,,2011-02-01,2011-02-21
3,235,CAPITAL AREA REGIONAL PLANNING COMMISSION (CARPC),Member,,2011-06-21,2014-09-23
4,10,COMMON COUNCIL ORGANIZATIONAL COMMITTEE (ended 4/2017),Chair,,2003-04-15,2004-04-19
4,5,ALCOHOL LICENSE REVIEW COMMITTEE,Member,Common Council Member,2005-04-20,2026-04-21
4,4,BOARD OF ESTIMATES (ended 4/2017),Member,,2004-09-07,2007-04-16
4,165,STATE STREET DESIGN PROJECT OVERSIGHT COMMITTEE (ended 12/12/2013),Member,District 4 Alder,2002-05-21,2013-12-12
4,162,SESQUICENTENNIAL AD HOC COMMISSION (prior to 12-1-2006),Member,,2004-07-06,2006-12-01
4,44,DOWNTOWN COORDINATING COMMITTEE,Member,Common Council Member,2000-09-05,2026-04-21
4,155,MID-STATE STREET PARKING RAMP COMMITTEE (prior to 11-15-2004),Member,,2004-07-01,2004-11-15
4,152,JOINT SOUTHEAST CAMPUS AREA COMMITTEE (ended 3/2018),Member,District 4 Alder,2002-11-19,2018-03-29
4,49,ETHICS BOARD,Member,Common Council President or Designee,2003-05-06,2026-04-21
4,50,HOUSING COMMITTEE (ended 6/2012),Member,,1999-03-16,2007-04-16
4,136,BASSETT TIF SET-ASIDE AD HOC COMMITTEE (prior to 1-17-2007),Member,,2002-03-19,2007-01-17
4,54,MADISON CULTURAL ARTS DISTRICT BOARD,Member,Common Council Member,2001-02-06,2026-04-21
4,121,MATC DOWNTOWN EDUCATION ADVISORY COMMITTEE (ended 4/2019),Member,Common Council Member,1995-11-07,2019-04-01
4,114,MADISON'S CENTRAL BUSINESS IMPROVEMENT DISTRICT (BID) BOARD,Member,District 4 Alder,2003-01-21,2026-04-21
4,112,SENIOR CENTER BOARD OF DIRECTORS (ended 5/2012),Member,,1995-04-18,2012-05-01
4,10,COMMON COUNCIL ORGANIZATIONAL COMMITTEE (ended 4/2017),Member,,2004-05-04,2005-04-19
4,12,MADISON ARTS COMMISSION,Member,,2003-04-15,2005-04-19
4,199,LANDLORD AND TENANT ISSUES SUBCOMMITTEE (ended 6/2012),Member,,2005-01-01,2007-04-17
4,10,COMMON COUNCIL ORGANIZATIONAL COMMITTEE (ended 4/2017),Member,,2006-09-19,2007-04-16
4,4,BOARD OF ESTIMATES (ended 4/2017),Member,,2007-04-17,2008-04-15
4,232,JAMES MADISON PARK PROPERTY PLANNING COMMITTEE (work completed 1-14-2009),Member,,2007-04-17,2009-01-15
4,10,COMMON COUNCIL ORGANIZATIONAL COMMITTEE (ended 4/2017),Chair,,2007-04-17,2008-04-15
4,241,"ERLANGER, JEFFREY CLAY, CIVILITY IN PUBLIC DISCOURSE AWARD COMMITTEE",Member,,2007-09-18,2008-04-15
4,242,VENDING OVERSIGHT COMMITTEE (prior to 8-4-2009),Member,Common Council or Citizen Member,2007-11-01,2009-08-03
4,249,FRANCES PLAZA PUBLIC ART SELECTION COMMITTEE (work completed 8-5-2008),Member,,2008-03-18,2008-08-08
4,4,BOARD OF ESTIMATES (ended 4/2017),Member,Common Council Member,2008-04-16,2016-04-19
4,10,COMMON COUNCIL ORGANIZATIONAL COMMITTEE (ended 4/2017),Member,,2008-04-22,2009-04-21
4,17,VENDING OVERSIGHT COMMITTEE (prior to 11-01-2007),Member,,2003-04-15,2007-10-31
4,263,VENDING OVERSIGHT COMMITTEE,Member,Downtown Common Council Member - Voting,2009-08-04,2026-04-21
4,39,CITY-COUNTY LIAISON COMMITTEE,Member,District 13 Alder,2010-02-02,2011-04-18
4,273,OVERTURE AD HOC COMMITTEE (ended 12/2010),Member,,2010-08-03,2010-12-31
4,56,MONONA TERRACE COMMUNITY AND CONVENTION CENTER BOARD,Member,City Appointee,2011-07-19,2027-05-01
4,285,AD HOC COMMITTEE ON MOPED PARKING (ended 8/2017),Member,,2012-03-06,2015-04-21
4,288,COMMITTEE ON AGING,Member,Common Council Member,2012-06-12,2025-03-11
4,293,JUDGE DOYLE SQUARE COMMITTEE  (ended 2/2014),Member,Common Council Member,2012-09-18,2014-02-28
4,297,TIF POLICY REVIEW AD HOC COMMITTEE (ended 4/2014),Member,Board of Estimates Member (Alder),2013-01-22,2014-04-01
4,300,SOUTH CAPITOL DISTRICT PLANNING COMMITTEE (ended 2/9/2015),Member,Common Council Member,2013-03-05,2015-02-09
4,304,LAMP HOUSE BLOCK AD HOC PLAN COMMITTEE (ended 3/2014),Member,Common Council Member,2013-09-17,2014-03-04
4,311,AD HOC DOWNTOWN PUBLIC RESTROOM COMMITTEE (ended 5/2015),Member,Downtown Alder,2014-05-21,2015-04-21
4,314,COMMITTEE ON EMPLOYEE RELATIONS,Member,Finance Committee Member,2015-04-21,2021-04-20
4,10,COMMON COUNCIL ORGANIZATIONAL COMMITTEE (ended 4/2017),Member,Alternate Common Council Member,2016-02-02,2016-04-19
4,10,COMMON COUNCIL ORGANIZATIONAL COMMITTEE (ended 4/2017),Member,Common Council President,2016-04-19,2017-04-18
4,241,"ERLANGER, JEFFREY CLAY, CIVILITY IN PUBLIC DISCOURSE AWARD COMMITTEE",Member,Common Council President,2016-04-19,2017-04-18
4,4,BOARD OF ESTIMATES (ended 4/2017),Member,Common Council President,2016-04-19,2017-04-18
4,1322,ROOM TAX COMMISSION,Member,Common Council Member,2016-06-21,2026-04-21
4,1324,FINANCE COMMITTEE,Member,Common Council Member,2017-04-18,2026-04-21
4,257,COMMITTEE ON SWEATFREE PURCHASES (Ended 6-2024),Member,Finance Committee Member,2017-04-18,2024-06-29
4,1325,COMMON COUNCIL EXECUTIVE COMMITTEE,Member,Alternate Common Council Member,2017-05-02,2018-04-17
4,1339,JOINT CAMPUS AREA COMMITTEE,Member,District 4 Alder,2018-04-17,2026-04-21
4,156,MONONA TERRACE BOOKING EVENT ASSISTANCE ADVISORY COMMITTEE,Member,Common Council Member,2019-04-16,2026-04-21
4,314,COMMITTEE ON EMPLOYEE RELATIONS,Member,Finance Committee Member,2022-05-24,2025-04-15
5,10,COMMON COUNCIL ORGANIZATIONAL COMMITTEE (ended 4/2017),Member,,2004-05-04,2005-04-19
5,153,JOINT WEST CAMPUS AREA COMMITTEE (ended 3/2018),Member,,2003-04-15,2009-04-20
5,94,"METROPOLITAN PLANNING ORGANIZATION (prior to May, 2007)",Member,,2003-04-15,2007-05-02
5,109,PEDESTRIAN/BICYCLE/MOTOR VEHICLE COMMISSION (ended 6/2018),Member,,2003-04-15,2009-04-20
5,53,LONG RANGE TRANSPORTATION PLANNING COMMITTEE (ended 6/2018),Member,,2003-06-03,2009-04-20
5,16,TRANSIT AND PARKING COMMISSION (ended 06/2018),Member,,2003-04-15,2005-04-19
5,40,COMMITTEE ON THE ENVIRONMENT (ended 6/2020),Member,,2003-04-15,2005-04-19
5,178,STREETCAR STUDY COMMITTEE (prior to 11-21-2007),Member,,2005-05-17,2007-11-21
5,10,COMMON COUNCIL ORGANIZATIONAL COMMITTEE (ended 4/2017),Member,,2006-05-02,2009-04-20
5,225,REGENT STREET-SOUTH CAMPUS PLAN STEERING COMMITTEE (prior to 7-1-2008),Member,,2007-01-02,2008-07-01
5,236,MADISON AREA TRANSPORTATION PLANNING BOARD (MPO) (prior to 9/30/2023),Member,,2007-04-17,2009-04-20
5,16,TRANSIT AND PARKING COMMISSION (ended 06/2018),Member,,2007-04-17,2009-04-20
5,210,GARVER BUILDING REUSE COMMITTEE (prior to 3-25-2008),Member,,2007-04-17,2008-06-20
5,109,PEDESTRIAN/BICYCLE/MOTOR VEHICLE COMMISSION (ended 6/2018),Vice Chair,Citizen (Bicycle Advocate),2009-05-05,2015-07-20
5,53,LONG RANGE TRANSPORTATION PLANNING COMMITTEE (ended 6/2018),Member,Pedestrian/Bicycle/Motor Vehicle Commission Chair or Designee,2009-07-21,2015-07-30
5,153,JOINT WEST CAMPUS AREA COMMITTEE (ended 3/2018),Member,,2009-10-20,2012-04-30
5,153,JOINT WEST CAMPUS AREA COMMITTEE (ended 3/2018),Member,Transportation-Related Committee Member,2012-09-18,2015-07-30
5,1348,TRANSPORTATION COMMISSION,Member,Adult City Resident,2021-11-16,2023-06-19
5,1348,TRANSPORTATION COMMISSION,Member,Resident Member,2023-06-20,2026-06-30
5,1339,JOINT CAMPUS AREA COMMITTEE,Member,Transportation-Related City Committee Member,2023-08-01,2026-06-30
6,5,ALCOHOL LICENSE REVIEW COMMITTEE,Member,,2002-11-05,2007-04-16
6,4,BOARD OF ESTIMATES (ended 4/2017),Member,,2001-04-17,2007-04-16
6,173,WILLIAMSON STREET BUILD II ADVISORY COMMITTEE (prior to 1-18-2005),Member,,2004-07-01,2005-01-18
6,159,REGENT/PARK EXPANDED TID 26 AFFORDABLE HOUSING SET-ASIDE COMMITTEE (prior to 4-5-2007),Member,,2004-01-06,2007-04-05
6,147,GREEN FLEET REVIEW SUBCOMMITTEE (prior to 11-16-2004),Member,,2004-07-01,2005-04-19
6,52,LANDMARKS COMMISSION,Member,,2001-04-17,2007-04-16
6,141,EAST WASHINGTON AVENUE DESIGN OVERSIGHT COMMITTEE (prior to 1-19-2007),Member,,2002-09-03,2007-01-19
6,134,"ALCOHOL USE IN PARKS AND CENTRAL CITY, AD HOC COMMITTEE TO INVESTIGATE (ended 3/2006)",Member,,2004-06-15,2006-03-21
6,133,ALCOHOL AND OTHER DRUGS POLICY COMMITTEE (prior to 3-21-2006),Member,,2003-09-02,2006-03-21
6,131,TIF REVIEW BOARD,Member,,2001-04-17,2007-04-16
6,123,NORTH MENDOTA PARKWAY ADVISORY COMMITTEE (prior to 10-22-2003),Member,,2003-09-05,2003-10-22
6,6,PUBLIC HEALTH COMMISSION (prior to 4-29-2005),Member,,2004-10-05,2005-04-29
6,177,BOARD OF ESTIMATES TIF SUBCOMMITTEE,Member,,2005-01-01,2006-09-28
6,142,EAST WASHINGTON/CAPITOL GATEWAY BUILD STEERING COMMITTEE(prior to 01/20/2010) ,Member,,2004-11-09,2007-04-16
6,178,STREETCAR STUDY COMMITTEE (prior to 11-21-2007),Member,,2005-02-01,2007-04-16
6,186,BOARD OF HEALTH FOR MADISON AND DANE COUNTY,Member,,2005-04-19,2007-04-16
6,195,SUSTAINABLE DESIGN AND ENERGY COMMITTEE (ended 6/2012),Member,,2005-07-05,2007-04-16
6,210,GARVER BUILDING REUSE COMMITTEE (prior to 3-25-2008),Member,,2006-09-05,2007-04-16
6,216,TAX INCREMENTAL FINANCING POLICY AD HOC COMMITTEE,Member,,2006-10-17,2007-04-16
6,227,CENTRAL PARK DESIGN AND IMPLEMENTATION TASK FORCE (ended 6/2011),Member,,2007-02-27,2007-04-17
6,210,GARVER BUILDING REUSE COMMITTEE (prior to 3-25-2008),Member,,2007-04-17,2008-06-20
6,178,STREETCAR STUDY COMMITTEE (prior to 11-21-2007),Member,,2007-05-15,2007-11-21
6,234,BLUE RIBBON COMMITTEE ON CLEAN ELECTIONS (ended 8/2009),Member,,2007-07-03,2009-08-19
6,3,PLAN COMMISSION,Member,,2007-09-04,2012-02-07
6,247,"NEIGHBORHOOD SUPPORT OFFICE, ADVISORY COMMITTEE TO GUIDE DEVELOPMENT & IMPLEMENTATION OF THE (prior to 1-2009)",Member,,2008-04-22,2009-01-02
6,255,HOUSING DIVERSITY PLANNING AD HOC COMMITTEE (ended 5/2011),Member,,2009-04-21,2011-05-26
6,272,MADISON CITY CHANNEL AD HOC ADVISORY COMMITTEE (ended 8/2010),Member,,2010-01-19,2010-08-31
7,10,COMMON COUNCIL ORGANIZATIONAL COMMITTEE (ended 4/2017),Member,,2003-05-06,2004-04-19
7,4,BOARD OF ESTIMATES (ended 4/2017),Member,,2005-04-20,2008-09-01
7,169,VERONA ROAD/WEST BELTLINE HIGHWAY ADVISORY COMMITTEE (prior to 3-7-2005),Member,,2003-04-15,2005-03-07
7,44,DOWNTOWN COORDINATING COMMITTEE,Member,,2004-01-16,2005-06-20
7,47,ECONOMIC DEVELOPMENT COMMITTEE,Member,,2003-04-15,2008-09-01
7,151,JOINT MONONA TERRACE/ALLIANT ENERGY STUDY COMMITTEE (prior to 9-13-2004),Member,,2004-07-01,2004-12-20
7,54,MADISON CULTURAL ARTS DISTRICT BOARD,Member,,2005-04-20,2008-09-01
7,6,PUBLIC HEALTH COMMISSION (prior to 4-29-2005),Member,,2004-10-05,2005-04-29
7,39,CITY-COUNTY LIAISON COMMITTEE,Member,,2003-04-15,2005-04-19
7,103,BOARD OF EDUCATION - COMMON COUNCIL LIAISON COMMITTEE (prior to 6/12/2012),Member,,2003-04-15,2005-04-19
7,10,COMMON COUNCIL ORGANIZATIONAL COMMITTEE (ended 4/2017),Member,,2005-05-03,2006-04-18
7,48,EQUAL OPPORTUNITIES COMMISSION,Member,,2005-07-19,2007-04-16
7,216,TAX INCREMENTAL FINANCING POLICY AD HOC COMMITTEE,Member,,2006-10-17,2008-09-16
7,235,CAPITAL AREA REGIONAL PLANNING COMMISSION (CARPC),Member,,2007-04-17,2016-04-01
7,39,CITY-COUNTY LIAISON COMMITTEE,Member,,2007-04-17,2008-09-01
8,41,COMMUNITY DEVELOPMENT BLOCK GRANT COMMITTEE,Member,,2004-01-06,2006-06-22
8,165,STATE STREET DESIGN PROJECT OVERSIGHT COMMITTEE (ended 12/12/2013),Member,,2003-04-15,2007-04-16
8,152,JOINT SOUTHEAST CAMPUS AREA COMMITTEE (ended 3/2018),Member,,2003-04-15,2007-04-16
8,50,HOUSING COMMITTEE (ended 6/2012),Member,,2003-05-06,2007-04-16
8,183,HOUSING AFFORDABILITY SUBCOM OF THE HOUSING COM,Member,,2005-01-01,2005-04-30
8,26,BOARD OF PARK COMMISSIONERS,Member,,2004-07-06,2005-04-19
8,109,PEDESTRIAN/BICYCLE/MOTOR VEHICLE COMMISSION (ended 6/2018),Member,,2004-07-06,2005-04-19
8,14,PUBLIC SAFETY REVIEW COMMITTEE,Member,,2003-04-15,2005-04-19
8,10,COMMON COUNCIL ORGANIZATIONAL COMMITTEE (ended 4/2017),Member,,2005-05-03,2006-04-18
8,14,PUBLIC SAFETY REVIEW COMMITTEE,Member,,2005-09-06,2007-04-16
8,199,LANDLORD AND TENANT ISSUES SUBCOMMITTEE (ended 6/2012),Member,,2005-01-01,2007-04-17
8,4,BOARD OF ESTIMATES (ended 4/2017),Member,,2006-04-18,2007-04-16
8,10,COMMON COUNCIL ORGANIZATIONAL COMMITTEE (ended 4/2017),Chair,,2006-04-18,2007-04-16
8,225,REGENT STREET-SOUTH CAMPUS PLAN STEERING COMMITTEE (prior to 7-1-2008),Member,,2007-01-02,2007-04-16
10,3,PLAN COMMISSION,Member,,2005-05-01,2007-04-16
10,169,VERONA ROAD/WEST BELTLINE HIGHWAY ADVISORY COMMITTEE (prior to 3-7-2005),Member,,2001-06-19,2005-03-07
10,153,JOINT WEST CAMPUS AREA COMMITTEE (ended 3/2018),,,2002-09-17,2007-04-16
10,135,ALLIED TIF SET-ASIDE AD HOC COMMITTEE (prior to 1-17-2007),Member,,2002-03-19,2007-01-17
10,124,PLANNING USER ADVISORY GROUP (Dane County) (prior to 4-4-2005),Member,,1995-03-21,2005-04-05
10,94,"METROPOLITAN PLANNING ORGANIZATION (prior to May, 2007)",Chair,,1999-11-16,2007-05-02
10,16,TRANSIT AND PARKING COMMISSION (ended 06/2018),Member,,1997-04-15,2007-04-16
10,39,CITY-COUNTY LIAISON COMMITTEE,Member,,2005-04-20,2007-04-16
10,53,LONG RANGE TRANSPORTATION PLANNING COMMITTEE (ended 6/2018),Member,,1998-03-10,2005-09-05
10,178,STREETCAR STUDY COMMITTEE (prior to 11-21-2007),Member,,2005-03-15,2007-05-15
10,4,BOARD OF ESTIMATES (ended 4/2017),Member,,2003-04-15,2005-04-19
10,53,LONG RANGE TRANSPORTATION PLANNING COMMITTEE (ended 6/2018),Member,,2005-09-06,2007-04-16
10,204,LONG RANGE METRO TRANSIT PLANNING AD HOC COMMITTEE,Member,,2006-09-05,2007-05-15
10,225,REGENT STREET-SOUTH CAMPUS PLAN STEERING COMMITTEE (prior to 7-1-2008),Member,,2007-01-02,2007-04-16
10,218,"PARKING STRATEGIC PLAN, AD HOC COMMITTEE TO DEVELOP (ended 4/2012)",Member,Common Council or Citizen Member,2007-02-27,2007-04-16
10,184,ALLIED AREA TASK FORCE,Member,Common Council or Citizen Member,2005-03-29,2007-04-16
10,235,CAPITAL AREA REGIONAL PLANNING COMMISSION (CARPC),Member,Mayoral Appointee,2011-06-21,2020-04-01
10,236,MADISON AREA TRANSPORTATION PLANNING BOARD (MPO) (prior to 9/30/2023),Member,Transportation-Related City Committee Member,2011-06-21,2019-07-30
10,16,TRANSIT AND PARKING COMMISSION (ended 06/2018),Member,First Alternate (Citizen or Alder),2011-09-20,2013-05-20
10,16,TRANSIT AND PARKING COMMISSION (ended 06/2018),Member,Citizen Member,2013-05-21,2018-06-30
10,31,ADA TRANSIT SUBCOMMITTEE TO THE TRANSIT AND PARKING COMM (ended 6/2018),Member,Transit and Parking Commission Member,2015-09-15,2017-02-08
10,139,CONTRACTED SERVICE OVERSIGHT SUBCOMMITTEE (ended 6/2018),Member,Transit and Parking Commission Member,2016-09-20,2018-06-30
11,10,COMMON COUNCIL ORGANIZATIONAL COMMITTEE (ended 4/2017),Member,,2001-04-17,2004-04-19
11,10,COMMON COUNCIL ORGANIZATIONAL COMMITTEE (ended 4/2017),Member,,2004-04-20,2005-04-19
11,169,VERONA ROAD/WEST BELTLINE HIGHWAY ADVISORY COMMITTEE (prior to 3-7-2005),Member,,2001-06-19,2005-03-07
11,166,SWIMMING POOL AD HOC COMMITTEE (prior to 6-25-2009),Member,,2004-02-03,2009-06-25
11,162,SESQUICENTENNIAL AD HOC COMMISSION (prior to 12-1-2006),Member,,2004-07-06,2006-12-01
11,3,PLAN COMMISSION,Member,,2003-05-01,2005-04-30
11,36,WATER UTILITY BOARD,Member,,1993-04-20,2005-04-19
11,31,ADA TRANSIT SUBCOMMITTEE TO THE TRANSIT AND PARKING COMM (ended 6/2018),Member,,1998-07-07,2005-04-18
11,42,COMMUNITY SERVICES COMMITTEE (ended 3/2025),Member,,1999-07-20,2005-04-19
11,153,JOINT WEST CAMPUS AREA COMMITTEE (ended 3/2018),,,2002-09-17,2005-04-19
11,99,CANVASSERS BOARD (prior to 6-11-2009),Member,,2005-05-03,2006-04-03
11,99,CANVASSERS BOARD (prior to 6-11-2009),Member,Ms.,2006-04-04,2009-06-11
11,98,ADMINISTRATIVE REVIEW BOARD (prior to 12/7/2011),Member,,2007-10-02,2011-11-29
11,42,COMMUNITY SERVICES COMMITTEE (ended 3/2025),Member,Community Representative,2011-06-21,2018-12-20
12,10,COMMON COUNCIL ORGANIZATIONAL COMMITTEE (ended 4/2017),Member,,2004-05-04,2005-04-19
12,4,BOARD OF ESTIMATES (ended 4/2017),Member,,2005-04-20,2007-04-16
12,32,AFFIRMATIVE ACTION COMMISSION,Member,,2003-04-15,2007-04-16
12,41,COMMUNITY DEVELOPMENT BLOCK GRANT COMMITTEE,Member,,2004-06-15,2005-04-19
12,45,EARLY CHILDHOOD CARE AND EDUCATION COMMITTEE,Member,,2003-04-15,2006-01-25
12,170,WARNER PARK COMMUNITY RECREATION CENTER ADVISORY COM (prior to 11-7-2006).,Member,,2003-04-15,2006-11-07
12,141,EAST WASHINGTON AVENUE DESIGN OVERSIGHT COMMITTEE (prior to 1-19-2007),Member,,2003-04-15,2007-01-19
12,176,CIVIL RIGHTS DEPT AD HOC COMMITTEE (prior to 6-21-2005),Member,,2005-01-18,2005-07-26
12,142,EAST WASHINGTON/CAPITOL GATEWAY BUILD STEERING COMMITTEE(prior to 01/20/2010) ,Member,,2004-11-09,2007-04-16
12,105,"HUMANITARIAN AWARD COMMISSION,  REVEREND  DOCTOR  MARTIN LUTHER KING JR. (prior to 8-11-2009)",Member,,2006-09-05,2007-04-16
12,211,PLATINUM BIKING CITY PLANNING COMMITTEE (prior to 11-18-2008),Member,,2006-09-05,2007-04-16
12,219,WARNER PARK STADIUM RENOVATION AD HOC COMMITTEE (prior to 2-21-2007),Member,,2006-10-16,2007-03-26
12,224,WARNER PARK COMMUNITY RECREATION CENTER ADVISORY SUBCOMMITTEE (ended 3-2023),Member,,2006-11-08,2007-04-16
12,5,ALCOHOL LICENSE REVIEW COMMITTEE,Member,,2007-06-19,2008-05-05
12,48,EQUAL OPPORTUNITIES COMMISSION,Member,Adult City Resident,2008-05-06,2013-12-31
12,14,PUBLIC SAFETY REVIEW COMMITTEE,Member,Alternate Member,2020-12-01,2021-04-20
12,319,CITY-COUNTY HOMELESS ISSUES COMMITTEE,Member,Common Council Member,2021-04-20,2023-04-18
12,42,COMMUNITY SERVICES COMMITTEE (ended 3/2025),Member,Common Council Member,2021-04-20,2023-04-18
12,48,EQUAL OPPORTUNITIES COMMISSION,Member,Common Council Member,2021-04-20,2023-04-18
12,14,PUBLIC SAFETY REVIEW COMMITTEE,Member,Common Council Member,2021-04-20,2023-04-18
12,307,COMMUNITY DEVELOPMENT DIVISION CONFERENCE COMMITTEE,Member,CSC Alder,2021-05-18,2023-04-18
12,1368,"PRESIDENT'S WORK GROUP ON RACIAL JUSTICE, ANTIRACISM AND EQUITY (ended 5/2022)",Member,Common Council Member,2021-05-18,2022-04-19
12,1369,PRESIDENT'S WORK GROUP ON ENVIRONMENTAL JUSTICE (ended 4/2022),Member,Common Council Member,2021-05-18,2022-04-19
14,4,BOARD OF ESTIMATES (ended 4/2017),Member,,1996-04-16,2008-04-21
14,91,COMMUNITY DEVELOPMENT AUTHORITY,Member,Common Council Member,2003-04-15,2013-04-15
14,178,STREETCAR STUDY COMMITTEE (prior to 11-21-2007),Member,,2005-02-01,2007-11-21
14,187,VILLAGER MALL MASTER PLAN OVERSIGHT AD HOC COMMITTEE (prior to 12-2005),Member,,2005-04-19,2005-12-21
14,10,COMMON COUNCIL ORGANIZATIONAL COMMITTEE (ended 4/2017),Member,,2006-05-02,2007-04-16
14,41,COMMUNITY DEVELOPMENT BLOCK GRANT COMMITTEE,Member,Common Council Member,2006-07-18,2013-04-15
14,10,COMMON COUNCIL ORGANIZATIONAL COMMITTEE (ended 4/2017),Member,,2007-04-17,2008-04-15
14,239,SOUTH MADISON AD HOC STEERING COMMITTEE (prior to 8-7-2007),Member,,2007-03-21,2007-08-10
14,241,"ERLANGER, JEFFREY CLAY, CIVILITY IN PUBLIC DISCOURSE AWARD COMMITTEE",Member,,2008-04-22,2010-05-03
14,10,COMMON COUNCIL ORGANIZATIONAL COMMITTEE (ended 4/2017),Chair,,2008-04-22,2010-04-20
14,4,BOARD OF ESTIMATES (ended 4/2017),Member,,2008-04-22,2010-05-03
14,254,HOUSING MERGER PLANNING AD HOC COMMITTEE (ended 2/2013),Member,,2008-11-18,2013-02-26
14,10,COMMON COUNCIL ORGANIZATIONAL COMMITTEE (ended 4/2017),Member,,2010-05-04,2011-04-19
14,4,BOARD OF ESTIMATES (ended 4/2017),Member,,2010-05-04,2011-04-18
14,273,OVERTURE AD HOC COMMITTEE (ended 12/2010),Member,,2010-08-03,2010-12-31
14,274,SISTER CITY AD HOC PLANNING COMMITTEE (ended 2/2011),Member,,2010-09-07,2011-02-01
14,277,REAPPORTIONMENT & REDISTRICTING AD HOC COMMITTEE (ended 8/2011),Member,District 13 Alder,2011-02-01,2011-08-02
14,36,WATER UTILITY BOARD,Member,,2011-04-19,2012-02-06
14,10,COMMON COUNCIL ORGANIZATIONAL COMMITTEE (ended 4/2017),Member,,2011-05-03,2012-04-17
14,10,COMMON COUNCIL ORGANIZATIONAL COMMITTEE (ended 4/2017),Member,,2012-05-01,2013-04-16
15,10,COMMON COUNCIL ORGANIZATIONAL COMMITTEE (ended 4/2017),Member,,2003-05-06,2004-04-19
15,93,MADISON PUBLIC LIBRARY BOARD,Member,,2003-04-15,2005-04-19
15,39,CITY-COUNTY LIAISON COMMITTEE,Member,,2003-04-15,2005-04-19
15,141,EAST WASHINGTON AVENUE DESIGN OVERSIGHT COMMITTEE (prior to 1-19-2007),Member,,2003-04-15,2005-04-19
15,48,EQUAL OPPORTUNITIES COMMISSION,Member,,2003-04-15,2005-04-19
15,93,MADISON PUBLIC LIBRARY BOARD,Member,Adult City Resident,2005-06-21,2016-09-30
16,10,COMMON COUNCIL ORGANIZATIONAL COMMITTEE (ended 4/2017),Member,,2004-05-04,2005-04-19
16,37,BROADBAND TELECOMMUNICATIONS REGULATORY BOARD (prior to 9-18-2008),Member,,1999-04-20,2008-09-18
16,166,SWIMMING POOL AD HOC COMMITTEE (prior to 6-25-2009),Member,,2003-02-04,2007-04-16
16,109,PEDESTRIAN/BICYCLE/MOTOR VEHICLE COMMISSION (ended 6/2018),Member,,2004-09-07,2011-04-30
16,39,CITY-COUNTY LIAISON COMMITTEE,Member,,1999-04-20,2011-04-18
16,195,SUSTAINABLE DESIGN AND ENERGY COMMITTEE (ended 6/2012),Member,,2007-04-17,2011-04-18
16,10,COMMON COUNCIL ORGANIZATIONAL COMMITTEE (ended 4/2017),Member,,2007-05-01,2010-05-03
16,255,HOUSING DIVERSITY PLANNING AD HOC COMMITTEE (ended 5/2011),Member,,2009-02-03,2011-04-18
16,265,SUSTAINABLE CITY AD HOC SUBCOMMITTEE FOR THE PRIVATE SECTOR (ended 3/2011),Member,District 13 Alder,2009-10-06,2011-03-24
16,272,MADISON CITY CHANNEL AD HOC ADVISORY COMMITTEE (ended 8/2010),Member,District 13 Alder,2010-02-02,2010-08-31
19,64,URBAN DESIGN COMMISSION,Member,,1995-04-18,2005-04-19
19,155,MID-STATE STREET PARKING RAMP COMMITTEE (prior to 11-15-2004),Member,,2004-07-01,2004-11-16
19,115,COMMUNITY ACTION COALITION FOR SOUTH CENTRAL WISCONSIN INC (ended 1-2020),Member,,1997-04-15,2005-04-19
19,60,SOLID WASTE ADVISORY COMMITTEE (ended 3/2020),Member,,2000-01-18,2005-04-19
20,10,COMMON COUNCIL ORGANIZATIONAL COMMITTEE (ended 4/2017),Member,,2003-04-15,2004-04-19
20,41,COMMUNITY DEVELOPMENT BLOCK GRANT COMMITTEE,Member,,1999-04-20,2007-04-16
20,103,BOARD OF EDUCATION - COMMON COUNCIL LIAISON COMMITTEE (prior to 6/12/2012),Member,,2005-04-20,2007-04-16
20,156,MONONA TERRACE BOOKING EVENT ASSISTANCE ADVISORY COMMITTEE,Member,,2001-05-15,2005-04-19
20,118,GREATER MADISON CONVENTION AND VISITORS BUREAU BOARD,Member,,2001-04-17,2005-04-19
21,2,Mayor,Chair,,2004-01-13,2007-04-17
21,4,BOARD OF ESTIMATES (ended 4/2017),Chair,,2003-04-15,2011-04-19
21,178,STREETCAR STUDY COMMITTEE (prior to 11-21-2007),Member,,2005-02-22,2007-11-21
2561,9,BOARD OF PUBLIC WORKS,Member,,2005-04-20,2011-04-18
2561,40,COMMITTEE ON THE ENVIRONMENT (ended 6/2020),Member,,2005-04-20,2011-04-18
2561,93,MADISON PUBLIC LIBRARY BOARD,Member,Common Council Member,2005-04-20,2015-04-21
2561,93,MADISON PUBLIC LIBRARY BOARD,Member,,1996-06-04,2005-04-19
2561,141,EAST WASHINGTON AVENUE DESIGN OVERSIGHT COMMITTEE (prior to 1-19-2007),Member,,2005-04-20,2007-01-19
2561,10,COMMON COUNCIL ORGANIZATIONAL COMMITTEE (ended 4/2017),Member,,2005-05-03,2006-04-18
2561,44,DOWNTOWN COORDINATING COMMITTEE,Member,,2005-06-21,2007-04-16
2561,202,LAKE EDGE/MONONA GROVE SCHOOL DISTRICT AD HOC COMMITTEE (prior to 11-2006),Member,,2006-03-07,2006-11-01
2561,210,GARVER BUILDING REUSE COMMITTEE (prior to 3-25-2008),Member,,2006-09-05,2008-06-20
2561,235,CAPITAL AREA REGIONAL PLANNING COMMISSION (CARPC),Member,Mayoral Appointee,2007-05-15,2022-03-28
2561,36,WATER UTILITY BOARD,Member,,2010-02-23,2011-04-18
2561,4,BOARD OF ESTIMATES (ended 4/2017),Member,Common Council Member,2011-04-19,2015-04-21
2561,10,COMMON COUNCIL ORGANIZATIONAL COMMITTEE (ended 4/2017),Member,,2011-05-03,2012-04-17
2561,224,WARNER PARK COMMUNITY RECREATION CENTER ADVISORY SUBCOMMITTEE (ended 3-2023),Member,District 12 Alder,2013-04-16,2019-04-16
2561,91,COMMUNITY DEVELOPMENT AUTHORITY,Member,Common Council Member,2014-05-20,2015-04-21
2561,311,AD HOC DOWNTOWN PUBLIC RESTROOM COMMITTEE (ended 5/2015),Member,City-County Homeless Issues Committee Member,2014-05-21,2015-04-21
2561,299,HOUSING STRATEGY COMMITTEE (end 11/2024),Member,Common Council Member,2015-04-21,2019-04-16
2561,284,MADISON LOCAL FOOD COMMITTEE (renamed Public Market Development Committee 12/2016),Member,Common Council Member,2015-04-21,2016-12-31
2561,9,BOARD OF PUBLIC WORKS,Member,Common Council Member,2015-04-21,2017-04-18
2561,319,CITY-COUNTY HOMELESS ISSUES COMMITTEE,Member,Common Council Member,2015-04-21,2019-04-16
2561,1326,PUBLIC MARKET DEVELOPMENT COMMITTEE (ended 1/2024),Member,Common Council Member,2017-01-01,2019-04-16
2561,53,LONG RANGE TRANSPORTATION PLANNING COMMITTEE (ended 6/2018),Member,,2017-07-11,2018-06-30
2561,236,MADISON AREA TRANSPORTATION PLANNING BOARD (MPO) (prior to 9/30/2023),Member,Elected Official,2017-04-18,2019-04-16
2561,1330,OSCAR MAYER STRATEGIC ASSESSMENT COMMITTEE (ended 2/2019),Member,Common Council Member,2017-10-03,2019-02-05
2561,1324,FINANCE COMMITTEE,Member,Common Council Member,2018-08-07,2019-04-16
2557,14,PUBLIC SAFETY REVIEW COMMITTEE,Member,,2005-04-20,2005-07-14
2557,16,TRANSIT AND PARKING COMMISSION (ended 06/2018),Member,,2005-04-20,2011-04-18
2557,39,CITY-COUNTY LIAISON COMMITTEE,Member,,2005-04-20,2009-04-21
2557,195,SUSTAINABLE DESIGN AND ENERGY COMMITTEE (ended 6/2012),Member,,2005-07-05,2007-04-16
2557,139,CONTRACTED SERVICE OVERSIGHT SUBCOMMITTEE (ended 6/2018),Member,,2005-09-06,2011-04-18
2557,204,LONG RANGE METRO TRANSIT PLANNING AD HOC COMMITTEE,Member,,2006-09-05,2008-09-16
2557,216,TAX INCREMENTAL FINANCING POLICY AD HOC COMMITTEE,Member,,2006-10-17,2007-04-16
2557,4,BOARD OF ESTIMATES (ended 4/2017),Member,,2007-04-17,2011-04-18
2557,216,TAX INCREMENTAL FINANCING POLICY AD HOC COMMITTEE,Member,,2007-04-17,2009-03-31
2557,54,MADISON CULTURAL ARTS DISTRICT BOARD,Member,,2008-09-02,2011-04-18
2558,3,PLAN COMMISSION,Member,,2005-05-01,2011-04-30
2558,42,COMMUNITY SERVICES COMMITTEE (ended 3/2025),Member,,2005-04-20,2011-04-18
2558,36,WATER UTILITY BOARD,Member,Common Council Member,2005-05-03,2015-04-21
2558,202,LAKE EDGE/MONONA GROVE SCHOOL DISTRICT AD HOC COMMITTEE (prior to 11-2006),Member,,2006-03-07,2006-04-13
2558,10,COMMON COUNCIL ORGANIZATIONAL COMMITTEE (ended 4/2017),Member,,2006-05-02,2007-04-30
2558,208,INCLUSIONARY ZONING ADVISORY OVERSIGHT COMMITTEE (prior to 4-18-2009),Member,,2006-08-01,2009-04-18
2558,186,BOARD OF HEALTH FOR MADISON AND DANE COUNTY,Member,,2007-04-17,2011-04-18
2558,248,EMERGING NEIGHBORHOODS FUND COMMITTEE (end 12/2008),Member,Common Council or Citizen Member,2008-02-26,2008-12-01
2558,246,ZONING CODE REWRITE ADVISORY COMMITTEE (ended 2/2013),Member,Common Council or Citizen Member,2008-02-26,2009-04-20
2558,156,MONONA TERRACE BOOKING EVENT ASSISTANCE ADVISORY COMMITTEE,Member,Common Council Member,2008-12-02,2015-04-21
2558,59,SENIOR CITIZENS ADVISORY COMMITTEE (ended 5/2012),Member,,2009-04-21,2011-04-18
2558,10,COMMON COUNCIL ORGANIZATIONAL COMMITTEE (ended 4/2017),Vice Chair,,2010-05-04,2011-04-19
2558,273,OVERTURE AD HOC COMMITTEE (ended 12/2010),Member,,2010-08-03,2010-12-31
2558,277,REAPPORTIONMENT & REDISTRICTING AD HOC COMMITTEE (ended 8/2011),Member,District 13 Alder,2011-02-01,2011-08-02
2558,39,CITY-COUNTY LIAISON COMMITTEE,Member,Common Council Member,2011-04-19,2013-04-15
2558,4,BOARD OF ESTIMATES (ended 4/2017),Member,Common Council President,2011-04-19,2012-04-16
2558,241,"ERLANGER, JEFFREY CLAY, CIVILITY IN PUBLIC DISCOURSE AWARD COMMITTEE",Member,,2011-05-03,2012-04-17
2558,10,COMMON COUNCIL ORGANIZATIONAL COMMITTEE (ended 4/2017),Member,,2011-05-03,2012-04-17
2558,10,COMMON COUNCIL ORGANIZATIONAL COMMITTEE (ended 4/2017),Member,,2012-05-01,2013-04-16
2558,41,COMMUNITY DEVELOPMENT BLOCK GRANT COMMITTEE,Member,Common Council Member,2012-05-01,2015-04-21
2558,287,UNION CORNERS AD HOC COMMITTEE (ended 6/2013),Member,Common Council Member,2012-06-12,2013-06-30
2558,288,COMMITTEE ON AGING,Member,Common Council Member,2012-06-12,2015-04-21
2558,295,EAST WASHINGTON AVENUE 800 BLOCK NORTH COMMITTEE (ended 4/2013),Member,Common Council Member,2012-10-30,2013-04-09
2558,280,SISTER CITY COLLABORATION COMMITTEE,Member,Common Council Member,2013-04-16,2015-04-21
2558,64,URBAN DESIGN COMMISSION,Member,Common Council Member,2013-04-16,2015-04-21
2558,307,COMMUNITY DEVELOPMENT DIVISION CONFERENCE COMMITTEE,Member,CDBG Alder,2014-02-25,2015-02-23
2558,310,CAPITOL EAST DISTRICT COMMITTEE (ended 2/2017),Member,Alder-At-Large,2014-09-02,2015-04-21
2558,235,CAPITAL AREA REGIONAL PLANNING COMMISSION (CARPC),Member,Mayoral Appointee,2014-11-18,2020-07-01
2558,36,WATER UTILITY BOARD,Member,Resident Member,2015-05-19,2021-09-30
2559,153,JOINT WEST CAMPUS AREA COMMITTEE (ended 3/2018),Member,,2005-04-20,2009-04-20
2559,12,MADISON ARTS COMMISSION,Member,,2005-04-20,2009-04-20
2559,60,SOLID WASTE ADVISORY COMMITTEE (ended 3/2020),Member,,2005-04-20,2009-04-20
2559,31,ADA TRANSIT SUBCOMMITTEE TO THE TRANSIT AND PARKING COMM (ended 6/2018),Member,,2005-12-13,2009-04-20
2559,3,PLAN COMMISSION,Member,,2007-05-01,2009-04-20
2559,53,LONG RANGE TRANSPORTATION PLANNING COMMITTEE (ended 6/2018),Member,,2007-11-20,2009-04-29
2559,246,ZONING CODE REWRITE ADVISORY COMMITTEE (ended 2/2013),Member,Common Council or Citizen Member,2008-02-26,2009-04-20
2559,3,PLAN COMMISSION,Member,,2009-05-05,2010-05-17
2559,246,ZONING CODE REWRITE ADVISORY COMMITTEE (ended 2/2013),Member,,2009-07-07,2011-05-31
2559,3,PLAN COMMISSION,Member,,2010-05-18,2011-01-18
2559,152,JOINT SOUTHEAST CAMPUS AREA COMMITTEE (ended 3/2018),Member,,2010-06-01,2011-04-30
2559,53,LONG RANGE TRANSPORTATION PLANNING COMMITTEE (ended 6/2018),Member,,2010-03-02,2011-07-30
2559,3,PLAN COMMISSION,Member,,2011-01-18,2011-05-31
2559,153,JOINT WEST CAMPUS AREA COMMITTEE (ended 3/2018),Member,District 11 Alder,2016-03-15,2017-04-18
2559,236,MADISON AREA TRANSPORTATION PLANNING BOARD (MPO) (prior to 9/30/2023),Member,Elected Official,2016-03-15,2017-04-18
2559,303,SUSTAINABLE MADISON TRANSPORTATION MASTER PLAN OVERSIGHT COMMITTEE (Madison in Motion) (ended 2/2017),Member,Common Council Member,2016-03-15,2017-02-28
2559,53,LONG RANGE TRANSPORTATION PLANNING COMMITTEE (ended 6/2018),Member,,2016-06-07,2017-04-18
2559,1323,METRO PARATRANSIT MEDICAID WAIVER FUNDING & POLICY REVIEW AD HOC COMMITTEE (ended 7/2017),Member,Common Council Member,2016-08-08,2017-07-11
2559,1326,PUBLIC MARKET DEVELOPMENT COMMITTEE (ended 1/2024),Member,Resident Member,2017-05-16,2024-01-11
2560,172,WINGRA CREEK BUILD ADVISORY PROJECT TEAM (prior to 1-2-2006),Member,,2005-04-20,2006-01-02
2560,91,COMMUNITY DEVELOPMENT AUTHORITY,Member,,2005-04-20,2007-04-16
2560,153,JOINT WEST CAMPUS AREA COMMITTEE (ended 3/2018),,,2005-04-20,2007-04-16
2560,103,BOARD OF EDUCATION - COMMON COUNCIL LIAISON COMMITTEE (prior to 6/12/2012),Member,,2005-04-20,2007-04-16
2560,152,JOINT SOUTHEAST CAMPUS AREA COMMITTEE (ended 3/2018),Member,,2005-04-20,2007-04-16
2560,132,ZOO COMMISSION - HENRY VILAS,Member,,2005-04-20,2007-04-16
2560,128,SOUTH MADISON HEALTH AND FAMILY CENTER-HARAMBEE (ended 3/2011),Member,,2005-04-20,2007-04-16
2560,187,VILLAGER MALL MASTER PLAN OVERSIGHT AD HOC COMMITTEE (prior to 12-2005),Member,,2005-04-19,2005-12-21
2560,10,COMMON COUNCIL ORGANIZATIONAL COMMITTEE (ended 4/2017),Member,,2005-05-03,2007-04-16
2560,107,MADISON HOUSING AUTHORITY,Member,,2005-05-03,2007-04-16
2560,113,BAYVIEW FOUNDATION BOARD,Member,,2005-06-07,2007-04-16
2560,137,CDA HOUSING OPERATIONS SUBCOMMITTEE (prior to 9-15-2009),Member,,2005-06-07,2007-04-16
2560,31,ADA TRANSIT SUBCOMMITTEE TO THE TRANSIT AND PARKING COMM (ended 6/2018),Member,,2005-04-19,2005-07-27
2560,225,REGENT STREET-SOUTH CAMPUS PLAN STEERING COMMITTEE (prior to 7-1-2008),Member,,2007-01-02,2007-04-16
2560,239,SOUTH MADISON AD HOC STEERING COMMITTEE (prior to 8-7-2007),Member,,2007-03-21,2007-04-17
2560,1361,PRESIDENT'S TASK FORCE ON CRITICAL ISSUES IMPACTING THE BLACK COMMUNITY (ended 1/2021),Member,Community Member,2020-08-04,2021-01-05
2560,1362,POLICE CIVILIAN OVERSIGHT BOARD,Member,Community-based Organization Representative,2020-10-06,2023-04-18
2560,5,ALCOHOL LICENSE REVIEW COMMITTEE,Member,Common Council Member,2023-04-18,2025-04-15
2560,288,COMMITTEE ON AGING,Member,Common Council Member,2023-04-18,2025-03-11
2560,39,CITY-COUNTY LIAISON COMMITTEE,Member,Common Council Member,2023-04-18,2025-04-15
2560,91,COMMUNITY DEVELOPMENT AUTHORITY,Member,Common Council Member,2023-04-18,2026-04-21
2560,14,PUBLIC SAFETY REVIEW COMMITTEE,Member,Common Council Member,2023-04-18,2026-04-21
2560,1385,COMMUNITY RESOURCES COMMITTEE,Member,Common Council Member,2025-04-15,2026-04-21
2184,156,MONONA TERRACE BOOKING EVENT ASSISTANCE ADVISORY COMMITTEE,Member,,2005-04-20,2007-04-17
2184,49,ETHICS BOARD,Member,,2004-07-06,2005-05-10
2184,118,GREATER MADISON CONVENTION AND VISITORS BUREAU BOARD,Member,,2005-04-20,2007-04-16
2184,36,WATER UTILITY BOARD,Member,,2005-04-20,2005-04-22
2184,16,TRANSIT AND PARKING COMMISSION (ended 06/2018),Member,,2005-04-20,2007-04-16
2184,47,ECONOMIC DEVELOPMENT COMMITTEE,Member,,2004-11-23,2005-04-30
2184,64,URBAN DESIGN COMMISSION,Member,,2005-04-20,2007-04-16
2184,204,LONG RANGE METRO TRANSIT PLANNING AD HOC COMMITTEE,Member,,2006-09-05,2007-04-16
2184,47,ECONOMIC DEVELOPMENT COMMITTEE,Member,,2007-08-07,2008-05-23
17,48,EQUAL OPPORTUNITIES COMMISSION,Member,,2005-04-20,2005-04-21
17,163,SMALL BUSINESS ENTERPRISE SPECIAL APPEALS BOARD,Member,,1999-11-30,2111-11-11
17,141,EAST WASHINGTON AVENUE DESIGN OVERSIGHT COMMITTEE (prior to 1-19-2007),Member,,2002-09-03,2007-01-19
17,154,PARKS LONG RANGE PLANNING SUBCOMMITTEE,Member,,2003-01-21,2005-07-18
17,134,"ALCOHOL USE IN PARKS AND CENTRAL CITY, AD HOC COMMITTEE TO INVESTIGATE (ended 3/2006)",Member,,2003-08-05,2006-03-21
17,26,BOARD OF PARK COMMISSIONERS,Member,,2000-01-04,2007-04-16
17,176,CIVIL RIGHTS DEPT AD HOC COMMITTEE (prior to 6-21-2005),Member,,2005-01-18,2005-07-26
17,9,BOARD OF PUBLIC WORKS,Member,,1997-04-15,2005-04-19
17,10,COMMON COUNCIL ORGANIZATIONAL COMMITTEE (ended 4/2017),Member,,2005-05-03,2006-04-17
17,41,COMMUNITY DEVELOPMENT BLOCK GRANT COMMITTEE,Member,,2005-06-21,2007-04-16
17,148,HABITAT STEWARDSHIP COMMITTEE (ended 3/2007),Member,,2005-07-05,2007-04-16
17,168,HABITAT STEWARDSHIP SUBCOMMITTEE (Parks),Member,,2005-07-05,2007-02-06
17,145,FACILITIES PROGRAMS AND FEES SUBCOMMITTEE (Parks),Member,,2007-02-07,2007-04-16
9,10,COMMON COUNCIL ORGANIZATIONAL COMMITTEE (ended 4/2017),Member,,2004-05-04,2006-04-18
9,170,WARNER PARK COMMUNITY RECREATION CENTER ADVISORY COM (prior to 11-7-2006).,Member,,2003-07-15,2006-04-17
9,169,VERONA ROAD/WEST BELTLINE HIGHWAY ADVISORY COMMITTEE (prior to 3-7-2005),Member,,2001-06-19,2005-03-07
9,158,PESTICIDE USE POLICY - AD HOC TASK FORCE ON (prior to 6-2004),Member,,2004-07-01,2004-07-08
9,150,ICE ARENA AD HOC COMMITTEE (prior to 1-18-2005),Member,,2003-06-03,2005-01-18
9,145,FACILITIES PROGRAMS AND FEES SUBCOMMITTEE (Parks),Member,,2003-04-15,2008-02-13
9,134,"ALCOHOL USE IN PARKS AND CENTRAL CITY, AD HOC COMMITTEE TO INVESTIGATE (ended 3/2006)",Member,,2003-08-05,2006-03-21
9,125,PUBLIC SAFETY COMMUNICATIONS CENTER BOARD (Dane County) (ended 5/2019),Member,Common Council or Citizen Member,2002-05-21,2007-04-17
9,26,BOARD OF PARK COMMISSIONERS,Member,,2003-04-15,2007-04-16
9,109,PEDESTRIAN/BICYCLE/MOTOR VEHICLE COMMISSION (ended 6/2018),Member,,2005-04-20,2011-04-30
9,14,PUBLIC SAFETY REVIEW COMMITTEE,Member,Common Council Member,2002-05-21,2019-04-16
9,92,DISABILITY RIGHTS COMMISSION,Member,,2004-12-14,2009-04-21
9,10,COMMON COUNCIL ORGANIZATIONAL COMMITTEE (ended 4/2017),Vice Chair,,2006-04-18,2006-09-06
9,210,GARVER BUILDING REUSE COMMITTEE (prior to 3-25-2008),Member,,2006-09-05,2007-04-16
9,236,MADISON AREA TRANSPORTATION PLANNING BOARD (MPO) (prior to 9/30/2023),Member,Elected Official,2007-04-17,2012-10-03
9,53,LONG RANGE TRANSPORTATION PLANNING COMMITTEE (ended 6/2018),Member,,2007-07-17,2011-04-19
9,125,PUBLIC SAFETY COMMUNICATIONS CENTER BOARD (Dane County) (ended 5/2019),Member,Common Council Member/Public Safety Review Committee Representative,2008-05-20,2019-04-16
9,26,BOARD OF PARK COMMISSIONERS,Member,,2009-04-21,2011-04-18
9,145,FACILITIES PROGRAMS AND FEES SUBCOMMITTEE (Parks),Member,,2009-07-21,2011-02-20
9,9,BOARD OF PUBLIC WORKS,Member,Common Council Member,2010-01-19,2017-04-18
9,59,SENIOR CITIZENS ADVISORY COMMITTEE (ended 5/2012),Member,District 13 Alder,2011-04-19,2012-05-01
9,195,SUSTAINABLE DESIGN AND ENERGY COMMITTEE (ended 6/2012),Member,District 13 Alder,2011-04-19,2012-02-06
9,224,WARNER PARK COMMUNITY RECREATION CENTER ADVISORY SUBCOMMITTEE (ended 3-2023),Member,,2011-02-21,2011-04-19
9,10,COMMON COUNCIL ORGANIZATIONAL COMMITTEE (ended 4/2017),Member,Common Council Member,2012-05-01,2014-04-29
9,298,LANDLORD AND TENANT ISSUES COMMITTEE (end 11/2024),Member,Common Council Member,2013-02-26,2015-04-21
9,91,COMMUNITY DEVELOPMENT AUTHORITY,Member,Common Council Member,2013-04-16,2014-03-11
9,283,ADMINISTRATIVE REVIEW BOARD,Member,Common Council Member,2012-05-01,2014-04-15
9,264,CDA HOUSING OPERATIONS SUBCOMMITTEE,Member,Common Council Member,2013-05-08,2014-03-11
9,109,PEDESTRIAN/BICYCLE/MOTOR VEHICLE COMMISSION (ended 6/2018),Member,Common Council Member,2015-04-21,2018-06-30
9,5,ALCOHOL LICENSE REVIEW COMMITTEE,Member,Common Council Member,2015-08-04,2021-04-20
9,53,LONG RANGE TRANSPORTATION PLANNING COMMITTEE (ended 6/2018),Member,Pedestrian/Bicycle/Motor Vehicle Commission Member,2015-09-15,2017-04-18
9,1320,TRANSPORTATION ORDINANCE REVIEW AD HOC COMMITTEE - ended 7/2017,Member,,2016-02-23,2017-07-14
9,1324,FINANCE COMMITTEE,Member,Common Council Member,2017-04-18,2019-04-16
9,53,LONG RANGE TRANSPORTATION PLANNING COMMITTEE (ended 6/2018),Member,Pedestrian/Bicycle/Motor Vehicle Commission Member,2017-08-01,2018-06-30
9,1336,TASK FORCE ON STRUCTURE OF CITY GOVERNMENT (ended 3/2020),Member,Common Council Member,2018-02-06,2020-03-03
9,1337,PRESIDENT'S WORK GROUP TO DEVELOP CITY-WIDE SURVEILLANCE EQUIPMENT & DATA MANAGEMENT POLICIES (ended 1/2020),Member,Common Council Member,2017-12-29,2020-01-16
9,1325,COMMON COUNCIL EXECUTIVE COMMITTEE,Member,Common Council Member,2018-05-01,2019-04-16
9,26,BOARD OF PARK COMMISSIONERS,Member,Common Council Member,2019-04-16,2021-04-20
9,1325,COMMON COUNCIL EXECUTIVE COMMITTEE,Member,Common Council Member,2020-05-05,2021-04-20
9,1360,AD HOC TASK FORCE ON THE STRUCTURE OF CITY GOVERNMENT (TFOGS) FINAL REPORT IMPLEMENTATION WORK GROUP (ended 3-2023),Member,Common Council Member,2020-11-02,2021-04-20
2220,142,EAST WASHINGTON/CAPITOL GATEWAY BUILD STEERING COMMITTEE(prior to 01/20/2010) ,Member,,2004-11-09,2007-08-06
2220,208,INCLUSIONARY ZONING ADVISORY OVERSIGHT COMMITTEE (prior to 4-18-2009),Member,,2006-08-01,2007-04-17
2220,216,TAX INCREMENTAL FINANCING POLICY AD HOC COMMITTEE,Member,,2006-11-07,2007-04-16
2220,227,CENTRAL PARK DESIGN AND IMPLEMENTATION TASK FORCE (ended 6/2011),Member,,2007-03-27,2007-04-16
2220,227,CENTRAL PARK DESIGN AND IMPLEMENTATION TASK FORCE (ended 6/2011),Member,,2007-04-17,2011-06-07
2220,41,COMMUNITY DEVELOPMENT BLOCK GRANT COMMITTEE,Member,,2007-04-17,2011-04-18
2220,210,GARVER BUILDING REUSE COMMITTEE (prior to 3-25-2008),Member,,2007-04-17,2008-06-20
2220,178,STREETCAR STUDY COMMITTEE (prior to 11-21-2007),Member,,2007-04-17,2007-11-21
2220,216,TAX INCREMENTAL FINANCING POLICY AD HOC COMMITTEE,Member,,2007-04-17,2009-03-31
2220,64,URBAN DESIGN COMMISSION,Member,Common Council Member,2007-04-17,2013-04-15
2220,142,EAST WASHINGTON/CAPITOL GATEWAY BUILD STEERING COMMITTEE(prior to 01/20/2010) ,Member,,2007-08-07,2010-01-20
2220,251,DOWNTOWN HOTEL FEASIBILITY STUDY COMMITTEE (prior to 3-17-2009),Member,,2008-04-08,2009-03-17
2220,255,HOUSING DIVERSITY PLANNING AD HOC COMMITTEE (ended 5/2011),Member,,2009-02-03,2011-05-26
2220,12,MADISON ARTS COMMISSION,Member,,2009-04-21,2011-04-18
2220,10,COMMON COUNCIL ORGANIZATIONAL COMMITTEE (ended 4/2017),Member,,2009-05-05,2011-04-19
2220,267,CULTURAL PLAN STEERING COMMITTEE (ended 9/2013),Member,District 13 Alder,2009-10-20,2011-04-18
2220,246,ZONING CODE REWRITE ADVISORY COMMITTEE (ended 2/2013),Member,District 13 Alder,2010-09-21,2011-07-05
2220,52,LANDMARKS COMMISSION,Member,Common Council Member,2011-04-19,2019-04-16
2220,3,PLAN COMMISSION,Member,Common Council Member,2011-05-01,2013-04-15
2220,53,LONG RANGE TRANSPORTATION PLANNING COMMITTEE (ended 6/2018),Member,,2011-10-18,2013-04-30
2220,284,MADISON LOCAL FOOD COMMITTEE (renamed Public Market Development Committee 12/2016),Member,Common Council Member,2011-09-06,2016-12-31
2220,287,UNION CORNERS AD HOC COMMITTEE (ended 6/2013),Member,Common Council Member,2012-05-15,2013-06-30
2220,295,EAST WASHINGTON AVENUE 800 BLOCK NORTH COMMITTEE (ended 4/2013),Member,Common Council Member,2012-10-30,2013-04-09
2220,300,SOUTH CAPITOL DISTRICT PLANNING COMMITTEE (ended 2/9/2015),Member,Common Council Member,2013-03-05,2015-02-09
2220,299,HOUSING STRATEGY COMMITTEE (end 11/2024),Member,Common Council Member,2013-04-16,2015-04-21
2220,12,MADISON ARTS COMMISSION,Member,Common Council Member,2013-04-16,2015-04-21
2220,109,PEDESTRIAN/BICYCLE/MOTOR VEHICLE COMMISSION (ended 6/2018),Member,Common Council Member,2013-04-16,2015-04-21
2220,10,COMMON COUNCIL ORGANIZATIONAL COMMITTEE (ended 4/2017),Member,Common Council Member,2013-04-30,2015-04-21
2220,283,ADMINISTRATIVE REVIEW BOARD,Member,Common Council Member,2013-04-30,2014-04-15
2220,267,CULTURAL PLAN STEERING COMMITTEE (ended 9/2013),Member,Common Council Member,2013-07-02,2013-09-05
2220,53,LONG RANGE TRANSPORTATION PLANNING COMMITTEE (ended 6/2018),Member,Pedestrian/Bicycle/Motor Vehicle Commission Member,2013-08-06,2015-04-21
2220,308,AD HOC LANDMARKS ORDINANCE REVIEW COMMITTEE,Member,Landmarks Commission Member (Alder),2014-05-06,2019-04-16
2220,309,GARVER FEED MILL CRITERIA  AND SELECTION COMMITTEE (ended 4/2015),Member,District 10 Alder,2014-05-06,2015-04-21
2220,310,CAPITOL EAST DISTRICT COMMITTEE (ended 2/2017),Member,District 6 Alder,2014-09-02,2017-02-10
2220,4,BOARD OF ESTIMATES (ended 4/2017),Member,Common Council Member,2015-04-21,2017-04-18
2220,319,CITY-COUNTY HOMELESS ISSUES COMMITTEE,Member,Common Council Member,2015-04-21,2017-04-18
2220,10,COMMON COUNCIL ORGANIZATIONAL COMMITTEE (ended 4/2017),Member,Common Council President Pro Tem,2016-04-19,2017-04-18
2220,314,COMMITTEE ON EMPLOYEE RELATIONS,Member,Board of Estimates Member (Alder),2016-05-17,2017-04-18
2220,1326,PUBLIC MARKET DEVELOPMENT COMMITTEE (ended 1/2024),Member,Common Council Member,2017-01-01,2021-04-20
2220,1324,FINANCE COMMITTEE,Member,Common Council President,2017-04-18,2018-04-17
2220,241,"ERLANGER, JEFFREY CLAY, CIVILITY IN PUBLIC DISCOURSE AWARD COMMITTEE",Member,Common Council President,2017-04-18,2017-10-16
2220,1327,PRESIDENT'S WORK GROUP ON POLICE & COMMUNITY RELATIONS (ended 5/2017),Member,Common Council President,2017-04-18,2017-05-17
2220,1325,COMMON COUNCIL EXECUTIVE COMMITTEE,Member,Common Council President,2017-04-18,2018-04-17
2220,1325,COMMON COUNCIL EXECUTIVE COMMITTEE,Member,Alternate Common Council Member,2018-05-01,2019-04-16
2220,1335,HISTORIC PRESERVATION PLAN ADVISORY COMMITTEE (ended 5/2020),Member,Common Council Member,2019-04-16,2020-05-19
2220,3,PLAN COMMISSION,Member,Common Council Member,2019-04-16,2021-04-20
2220,36,WATER UTILITY BOARD,Member,Common Council Member,2019-04-16,2021-04-20
2220,308,AD HOC LANDMARKS ORDINANCE REVIEW COMMITTEE,Member,Council President Recommendation (Alder),2019-04-19,2021-04-20
2220,1357,PRESIDENT'S WORK GROUP TO REVIEW ADMINISTRATIVE PROCEDURE MEMORANDA (APM) APPLICABLE TO ALDERS (ended 5/2021),Member,Common Council Member,2019-09-03,2021-04-20
2220,288,COMMITTEE ON AGING,Member,Common Council Member,2020-04-21,2021-01-26
2220,308,AD HOC LANDMARKS ORDINANCE REVIEW COMMITTEE,Member,Resident Member,2021-08-31,2022-04-19
2220,12,MADISON ARTS COMMISSION,Member,Common Council Member,2023-04-18,2025-04-15
2220,1324,FINANCE COMMITTEE,Member,Common Council Member,2023-04-18,2025-04-15
2220,1326,PUBLIC MARKET DEVELOPMENT COMMITTEE (ended 1/2024),Member,Common Council Member,2023-04-18,2024-01-11
2220,64,URBAN DESIGN COMMISSION,Member,Common Council Member,2023-04-18,2025-04-15
2930,44,DOWNTOWN COORDINATING COMMITTEE,Member,,2007-04-17,2009-04-20
2930,50,HOUSING COMMITTEE (ended 6/2012),Member,,2007-04-17,2009-04-20
2930,232,JAMES MADISON PARK PROPERTY PLANNING COMMITTEE (work completed 1-14-2009),Member,,2007-04-17,2009-01-15
2930,152,JOINT SOUTHEAST CAMPUS AREA COMMITTEE (ended 3/2018),Member,,2007-04-17,2009-04-20
2930,14,PUBLIC SAFETY REVIEW COMMITTEE,Member,,2007-04-17,2009-04-20
2930,225,REGENT STREET-SOUTH CAMPUS PLAN STEERING COMMITTEE (prior to 7-1-2008),Member,,2007-04-17,2008-07-01
2930,165,STATE STREET DESIGN PROJECT OVERSIGHT COMMITTEE (ended 12/12/2013),Member,,2007-04-17,2009-04-20
2930,199,LANDLORD AND TENANT ISSUES SUBCOMMITTEE (ended 6/2012),Member,,2007-04-19,2009-04-20
2930,249,FRANCES PLAZA PUBLIC ART SELECTION COMMITTEE (work completed 8-5-2008),Member,,2008-03-18,2008-08-08
2930,125,PUBLIC SAFETY COMMUNICATIONS CENTER BOARD (Dane County) (ended 5/2019),Member,Common Council or Citizen Member,2007-05-15,2008-05-19
2930,14,PUBLIC SAFETY REVIEW COMMITTEE,Member,,2009-06-16,2010-08-06
2930,272,MADISON CITY CHANNEL AD HOC ADVISORY COMMITTEE (ended 8/2010),Member,,2010-02-23,2010-08-06
2930,1335,HISTORIC PRESERVATION PLAN ADVISORY COMMITTEE (ended 5/2020),Member,Resident Member,2018-02-06,2020-05-19
2284,169,VERONA ROAD/WEST BELTLINE HIGHWAY ADVISORY COMMITTEE (prior to 3-7-2005),Member,,2001-07-03,2005-03-07
2284,48,EQUAL OPPORTUNITIES COMMISSION,Member,,2005-09-20,2007-04-16
2284,184,ALLIED AREA TASK FORCE,Member,District 10 Alder,2007-04-17,2013-04-15
2284,42,COMMUNITY SERVICES COMMITTEE (ended 3/2025),Member,,2007-04-17,2011-04-18
2284,48,EQUAL OPPORTUNITIES COMMISSION,Member,,2007-04-17,2013-04-15
2284,153,JOINT WEST CAMPUS AREA COMMITTEE (ended 3/2018),Member,,2007-04-17,2013-04-16
2284,225,REGENT STREET-SOUTH CAMPUS PLAN STEERING COMMITTEE (prior to 7-1-2008),Member,,2007-04-17,2008-07-01
2284,16,TRANSIT AND PARKING COMMISSION (ended 06/2018),Member,,2007-04-17,2011-04-18
2284,218,"PARKING STRATEGIC PLAN, AD HOC COMMITTEE TO DEVELOP (ended 4/2012)",Member,,2007-06-19,2011-04-19
2284,255,HOUSING DIVERSITY PLANNING AD HOC COMMITTEE (ended 5/2011),Member,,2009-02-03,2011-05-26
2284,261,LOW INCOME BUS PASS PROGRAM COMMITTEE (ended 6/2010),Member,,2009-06-16,2010-06-01
2284,4,BOARD OF ESTIMATES (ended 4/2017),Member,,2011-04-19,2013-04-15
2788,204,LONG RANGE METRO TRANSIT PLANNING AD HOC COMMITTEE,Member,,2006-09-19,2008-09-16
2788,4,BOARD OF ESTIMATES (ended 4/2017),Member,,2007-04-17,2013-04-15
2788,236,MADISON AREA TRANSPORTATION PLANNING BOARD (MPO) (prior to 9/30/2023),Member,,2007-04-17,2009-04-20
2788,195,SUSTAINABLE DESIGN AND ENERGY COMMITTEE (ended 6/2012),Member,,2007-04-17,2011-04-18
2788,224,WARNER PARK COMMUNITY RECREATION CENTER ADVISORY SUBCOMMITTEE (ended 3-2023),Member,,2007-04-17,2013-04-15
2788,10,COMMON COUNCIL ORGANIZATIONAL COMMITTEE (ended 4/2017),Member,,2007-05-01,2009-04-21
2788,103,BOARD OF EDUCATION - COMMON COUNCIL LIAISON COMMITTEE (prior to 6/12/2012),Member,,2007-06-19,2011-04-18
2788,142,EAST WASHINGTON/CAPITOL GATEWAY BUILD STEERING COMMITTEE(prior to 01/20/2010) ,Member,,2007-08-07,2010-01-20
2788,53,LONG RANGE TRANSPORTATION PLANNING COMMITTEE (ended 6/2018),Member,,2007-10-16,2009-06-01
2788,246,ZONING CODE REWRITE ADVISORY COMMITTEE (ended 2/2013),Member,Common Council Member,2008-02-26,2013-02-05
2788,257,COMMITTEE ON SWEATFREE PURCHASES (Ended 6-2024),Member,Board of Estimates Member (Alder),2009-05-05,2013-04-16
2788,266,SUSTAINABLE CITY AD HOC SUBCOMMITTEE FOR THE PUBLIC SECTOR (ended 3/2011),Member,District 13 Alder,2009-10-06,2011-03-24
2788,50,HOUSING COMMITTEE (ended 6/2012),Member,,2010-10-19,2011-04-18
2788,277,REAPPORTIONMENT & REDISTRICTING AD HOC COMMITTEE (ended 8/2011),Member,District 13 Alder,2011-02-01,2011-08-02
2788,42,COMMUNITY SERVICES COMMITTEE (ended 3/2025),Member,Common Council Member,2011-04-19,2013-04-15
2788,267,CULTURAL PLAN STEERING COMMITTEE (ended 9/2013),Member,,2011-04-19,2013-04-16
2788,12,MADISON ARTS COMMISSION,Member,Common Council Member,2011-04-19,2013-04-15
2788,115,COMMUNITY ACTION COALITION FOR SOUTH CENTRAL WISCONSIN INC (ended 1-2020),Member,,2011-06-21,2013-04-15
2788,284,MADISON LOCAL FOOD COMMITTEE (renamed Public Market Development Committee 12/2016),Member,Common Council Member,2011-09-06,2013-04-15
2788,195,SUSTAINABLE DESIGN AND ENERGY COMMITTEE (ended 6/2012),Member,,2012-02-07,2012-06-12
2788,10,COMMON COUNCIL ORGANIZATIONAL COMMITTEE (ended 4/2017),Member,,2012-05-01,2013-04-16
2788,286,"EMERGING NEIGHBORHOODS FUND WORKGROUP, AD HOC (ended 7/2012)",Member,District 13 Alder,2012-05-01,2012-07-03
2788,287,UNION CORNERS AD HOC COMMITTEE (ended 6/2013),Member,Common Council Member,2012-05-15,2013-04-16
2788,291,SUSTAINABLE MADISON COMMITTEE,Member,Common Council Member,2012-02-07,2013-04-15
2788,294,MADISON FOOD POLICY COUNCIL,Member,Common Council Member,2012-10-16,2013-04-15
2788,294,MADISON FOOD POLICY COUNCIL,Member,Resident Member,2013-06-01,2019-04-16
2788,1330,OSCAR MAYER STRATEGIC ASSESSMENT COMMITTEE (ended 2/2019),Member,Resident Member,2017-10-03,2019-02-05
2788,1324,FINANCE COMMITTEE,Member,Mayor,2019-04-16,2027-04-20
2605,50,HOUSING COMMITTEE (ended 6/2012),Member,,2005-06-21,2007-04-30
2605,225,REGENT STREET-SOUTH CAMPUS PLAN STEERING COMMITTEE (prior to 7-1-2008),Member,,2007-01-02,2007-04-16
2605,91,COMMUNITY DEVELOPMENT AUTHORITY,Member,,2007-04-17,2011-04-18
2605,152,JOINT SOUTHEAST CAMPUS AREA COMMITTEE (ended 3/2018),Member,,2007-04-17,2011-04-18
2605,153,JOINT WEST CAMPUS AREA COMMITTEE (ended 3/2018),Member,,2007-04-17,2011-04-18
2605,3,PLAN COMMISSION,Member,,2007-05-01,2011-04-30
2605,225,REGENT STREET-SOUTH CAMPUS PLAN STEERING COMMITTEE (prior to 7-1-2008),Member,,2007-04-17,2008-07-01
2605,128,SOUTH MADISON HEALTH AND FAMILY CENTER-HARAMBEE (ended 3/2011),Member,,2007-04-17,2011-03-15
2605,132,ZOO COMMISSION - HENRY VILAS,Member,,2007-04-17,2011-04-18
2605,137,CDA HOUSING OPERATIONS SUBCOMMITTEE (prior to 9-15-2009),Member,,2007-06-05,2008-09-09
2605,196,CDA LONG RANGE PLANNING SUBCOMMITTEE (prior to 4-2-2009),Member,,2007-07-03,2009-04-21
2605,107,MADISON HOUSING AUTHORITY,Member,,2007-08-07,2011-04-18
2605,113,BAYVIEW FOUNDATION BOARD,Member,District 13 Alder,2007-05-01,2011-04-18
2605,246,ZONING CODE REWRITE ADVISORY COMMITTEE (ended 2/2013),Member,Common Council or Citizen Member,2008-02-26,2009-04-20
2605,246,ZONING CODE REWRITE ADVISORY COMMITTEE (ended 2/2013),Member,,2009-04-21,2011-04-30
2605,14,PUBLIC SAFETY REVIEW COMMITTEE,Member,District 13 Alder,2010-01-05,2010-09-21
2605,165,STATE STREET DESIGN PROJECT OVERSIGHT COMMITTEE (ended 12/12/2013),Member,,2010-05-04,2011-04-30
55,9,BOARD OF PUBLIC WORKS,Member,,2003-09-02,2007-04-16
55,32,AFFIRMATIVE ACTION COMMISSION,Chair,,1995-04-18,2007-04-16
55,32,AFFIRMATIVE ACTION COMMISSION,Member,Common Council Member,2007-04-17,2015-04-21
55,227,CENTRAL PARK DESIGN AND IMPLEMENTATION TASK FORCE (ended 6/2011),Member,,2007-04-17,2011-06-07
55,236,MADISON AREA TRANSPORTATION PLANNING BOARD (MPO) (prior to 9/30/2023),Member,,2007-04-17,2010-04-30
55,26,BOARD OF PARK COMMISSIONERS,Member,Common Council Member,2007-04-17,2015-04-21
55,9,BOARD OF PUBLIC WORKS,Member,,2007-04-17,2010-01-05
55,10,COMMON COUNCIL ORGANIZATIONAL COMMITTEE (ended 4/2017),Member,,2007-05-01,2008-04-15
55,204,LONG RANGE METRO TRANSIT PLANNING AD HOC COMMITTEE,Member,Common Council or Citizen Member,2008-01-08,2008-09-16
55,145,FACILITIES PROGRAMS AND FEES SUBCOMMITTEE (Parks),Member,,2007-07-17,2008-02-13
55,145,FACILITIES PROGRAMS AND FEES SUBCOMMITTEE (Parks),Member,Common Council or Citizen Member,2008-02-26,2009-03-02
55,166,SWIMMING POOL AD HOC COMMITTEE (prior to 6-25-2009),Member,,2008-04-08,2009-06-25
55,4,BOARD OF ESTIMATES (ended 4/2017),Member,Common Council Member,2008-09-02,2015-04-21
55,154,PARKS LONG RANGE PLANNING SUBCOMMITTEE,Member,Board of Park Commissioners Member,2009-07-21,2015-04-21
55,47,ECONOMIC DEVELOPMENT COMMITTEE,Member,District 13 Alder,2010-01-05,2011-04-18
55,292,PAYMENTS IN LIEU OF TAXES (PILOT) TASK FORCE (ended 8/2013),Member,Common Council Member,2012-07-17,2013-08-06
55,300,SOUTH CAPITOL DISTRICT PLANNING COMMITTEE (ended 2/9/2015),Member,Common Council Member,2013-04-30,2015-02-09
55,309,GARVER FEED MILL CRITERIA  AND SELECTION COMMITTEE (ended 4/2015),Member,Common Council Member,2014-05-06,2015-04-21
55,314,COMMITTEE ON EMPLOYEE RELATIONS,Member,Board of Estimates Member (Alder),2015-03-17,2015-04-21
55,9,BOARD OF PUBLIC WORKS,Member,Adult City Resident,2017-03-07,2025-06-05
2931,5,ALCOHOL LICENSE REVIEW COMMITTEE,Member,District 13 Alder,2007-04-17,2011-04-18
2931,26,BOARD OF PARK COMMISSIONERS,Member,,2007-04-17,2009-04-20
2931,59,SENIOR CITIZENS ADVISORY COMMITTEE (ended 5/2012),Member,,2007-04-17,2009-04-20
2931,166,SWIMMING POOL AD HOC COMMITTEE (prior to 6-25-2009),Member,,2007-04-17,2009-06-25
2931,224,WARNER PARK COMMUNITY RECREATION CENTER ADVISORY SUBCOMMITTEE (ended 3-2023),Member,,2007-04-17,2011-04-18
2931,10,COMMON COUNCIL ORGANIZATIONAL COMMITTEE (ended 4/2017),Member,,2007-05-01,2011-04-18
2931,154,PARKS LONG RANGE PLANNING SUBCOMMITTEE,Member,,2007-07-17,2009-04-21
2931,232,JAMES MADISON PARK PROPERTY PLANNING COMMITTEE (work completed 1-14-2009),Member,,2007-09-04,2009-01-15
2931,36,WATER UTILITY BOARD,Member,,2007-09-04,2010-02-23
2931,118,GREATER MADISON CONVENTION AND VISITORS BUREAU BOARD,Member,,2008-04-16,2009-04-21
2931,250,TRANSIENT AND OCCUPANCY (TOT) STUDY COMMITTEE (ended 12/2009),Member,,2008-03-18,2009-12-10
2931,39,CITY-COUNTY LIAISON COMMITTEE,Member,,2008-09-02,2010-02-02
2931,255,HOUSING DIVERSITY PLANNING AD HOC COMMITTEE (ended 5/2011),Member,,2009-02-03,2011-04-18
2931,145,FACILITIES PROGRAMS AND FEES SUBCOMMITTEE (Parks),Member,,2009-03-03,2009-04-21
2931,50,HOUSING COMMITTEE (ended 6/2012),Member,,2009-04-21,2010-10-19
2931,3,PLAN COMMISSION,Member,,2009-04-21,2011-04-30
1779,47,ECONOMIC DEVELOPMENT COMMITTEE,Member,,2005-06-21,2007-06-04
1779,4,BOARD OF ESTIMATES (ended 4/2017),Member,,2007-04-17,2010-05-03
1779,211,PLATINUM BIKING CITY PLANNING COMMITTEE (prior to 11-18-2008),Member,,2007-04-17,2008-11-18
1779,103,BOARD OF EDUCATION - COMMON COUNCIL LIAISON COMMITTEE (prior to 6/12/2012),Member,,2007-06-19,2009-04-21
1779,247,"NEIGHBORHOOD SUPPORT OFFICE, ADVISORY COMMITTEE TO GUIDE DEVELOPMENT & IMPLEMENTATION OF THE (prior to 1-2009)",Member,,2008-04-08,2009-01-02
1779,10,COMMON COUNCIL ORGANIZATIONAL COMMITTEE (ended 4/2017),Member,,2008-04-22,2010-05-03
1779,47,ECONOMIC DEVELOPMENT COMMITTEE,Member,Common Council Member,2008-09-02,2015-04-21
1779,255,HOUSING DIVERSITY PLANNING AD HOC COMMITTEE (ended 5/2011),Member,,2009-02-03,2011-05-26
1779,92,DISABILITY RIGHTS COMMISSION,Member,Common Council Member,2009-04-21,2018-08-06
1779,236,MADISON AREA TRANSPORTATION PLANNING BOARD (MPO) (prior to 9/30/2023),Member,Elected Official,2010-01-05,2018-08-06
1779,10,COMMON COUNCIL ORGANIZATIONAL COMMITTEE (ended 4/2017),Chair,,2010-05-04,2011-04-19
1779,4,BOARD OF ESTIMATES (ended 4/2017),Member,,2010-05-04,2011-04-18
1779,241,"ERLANGER, JEFFREY CLAY, CIVILITY IN PUBLIC DISCOURSE AWARD COMMITTEE",Member,,2010-05-04,2011-04-19
1779,39,CITY-COUNTY LIAISON COMMITTEE,Member,Common Council Member,2011-04-19,2018-08-06
1779,26,BOARD OF PARK COMMISSIONERS,Member,Common Council Member,2011-04-19,2017-04-18
1779,10,COMMON COUNCIL ORGANIZATIONAL COMMITTEE (ended 4/2017),Member,,2011-05-03,2012-04-17
1779,287,UNION CORNERS AD HOC COMMITTEE (ended 6/2013),Member,Common Council Member,2012-05-15,2013-06-30
1779,295,EAST WASHINGTON AVENUE 800 BLOCK NORTH COMMITTEE (ended 4/2013),Member,Common Council Member,2012-10-30,2013-04-09
1779,297,TIF POLICY REVIEW AD HOC COMMITTEE (ended 4/2014),Member,Economic Development Committee Member (Alder),2013-01-22,2014-04-01
1779,306,DIGITAL TECHNOLOGY COMMITTEE (ended 11-2021),Member,Common Council Member,2013-12-03,2018-08-06
1779,10,COMMON COUNCIL ORGANIZATIONAL COMMITTEE (ended 4/2017),Member,Alternate Common Council Member,2014-05-06,2015-04-21
1779,308,AD HOC LANDMARKS ORDINANCE REVIEW COMMITTEE,Member,Economic Development Committee Member (Alder),2014-05-06,2017-03-20
1779,10,COMMON COUNCIL ORGANIZATIONAL COMMITTEE (ended 4/2017),Member,Common Council Member,2015-05-05,2016-04-19
1779,1320,TRANSPORTATION ORDINANCE REVIEW AD HOC COMMITTEE - ended 7/2017,Member,,2016-02-23,2017-07-14
1779,1322,ROOM TAX COMMISSION,Member,Common Council Member,2016-06-21,2018-08-06
1779,9,BOARD OF PUBLIC WORKS,Member,Common Council Member,2017-04-18,2018-08-06
1779,308,AD HOC LANDMARKS ORDINANCE REVIEW COMMITTEE,Member,Common Council President or Designee,2017-03-21,2018-04-17
1779,1325,COMMON COUNCIL EXECUTIVE COMMITTEE,Member,Common Council Member,2018-05-01,2018-08-08
2932,41,COMMUNITY DEVELOPMENT BLOCK GRANT COMMITTEE,Member,,2007-04-17,2009-04-20
2932,118,GREATER MADISON CONVENTION AND VISITORS BUREAU BOARD,Member,,2007-04-17,2008-04-15
2932,156,MONONA TERRACE BOOKING EVENT ASSISTANCE ADVISORY COMMITTEE,Member,,2007-05-15,2008-12-01
2932,242,VENDING OVERSIGHT COMMITTEE (prior to 8-4-2009),Member,Common Council or Citizen Member,2007-11-01,2009-08-03
2932,248,EMERGING NEIGHBORHOODS FUND COMMITTEE (end 12/2008),Member,Common Council or Citizen Member,2008-02-26,2008-12-01
2932,17,VENDING OVERSIGHT COMMITTEE (prior to 11-01-2007),Member,,2007-04-17,2007-10-31
2932,263,VENDING OVERSIGHT COMMITTEE,Member,,2009-08-04,2011-04-18
1718,134,"ALCOHOL USE IN PARKS AND CENTRAL CITY, AD HOC COMMITTEE TO INVESTIGATE (ended 3/2006)",Member,,2004-06-01,2006-03-21
1718,110,POLICE AND FIRE COMMISSION,Member,,2004-09-21,2009-04-17
1718,6,PUBLIC HEALTH COMMISSION (prior to 4-29-2005),Member,,2000-12-05,2005-04-29
1718,176,CIVIL RIGHTS DEPT AD HOC COMMITTEE (prior to 6-21-2005),Member,,2005-01-04,2005-07-26
1718,41,COMMUNITY DEVELOPMENT BLOCK GRANT COMMITTEE,Member,,2009-04-21,2012-04-30
1718,45,EARLY CHILDHOOD CARE AND EDUCATION COMMITTEE,Member,,2009-04-21,2011-04-18
1718,103,BOARD OF EDUCATION - COMMON COUNCIL LIAISON COMMITTEE (prior to 6/12/2012),Member,,2009-04-21,2012-06-12
1718,153,JOINT WEST CAMPUS AREA COMMITTEE (ended 3/2018),Member,District 5 Alder,2009-04-21,2018-03-29
1718,10,COMMON COUNCIL ORGANIZATIONAL COMMITTEE (ended 4/2017),Member,,2009-05-05,2011-04-19
1718,261,LOW INCOME BUS PASS PROGRAM COMMITTEE (ended 6/2010),Member,,2009-06-16,2010-06-01
1718,262,COMPLETE COUNT COMMITTEE (ended 5/2010),Member,District 13 Alder,2009-10-06,2010-10-01
1718,5,ALCOHOL LICENSE REVIEW COMMITTEE,Member,Common Council Member,2010-01-05,2019-04-16
1718,39,CITY-COUNTY LIAISON COMMITTEE,Member,,2011-04-19,2012-08-06
1718,10,COMMON COUNCIL ORGANIZATIONAL COMMITTEE (ended 4/2017),Member,,2011-05-03,2012-04-17
1718,4,BOARD OF ESTIMATES (ended 4/2017),Member,,2012-04-17,2013-04-15
1718,10,COMMON COUNCIL ORGANIZATIONAL COMMITTEE (ended 4/2017),Member,,2012-05-01,2013-04-16
1718,241,"ERLANGER, JEFFREY CLAY, CIVILITY IN PUBLIC DISCOURSE AWARD COMMITTEE",Member,,2012-05-01,2013-04-16
1718,289,EDUCATION COMMITTEE (prior to 10/1/2023),Member,Common Council Member,2009-04-21,2021-04-20
1718,293,JUDGE DOYLE SQUARE COMMITTEE  (ended 2/2014),Member,Common Council Member,2012-09-18,2014-02-28
1718,294,MADISON FOOD POLICY COUNCIL,Member,Common Council Member,2012-10-16,2015-10-05
1718,297,TIF POLICY REVIEW AD HOC COMMITTEE (ended 4/2014),Member,Council President Recommendation (Alder),2013-01-22,2014-04-01
1718,10,COMMON COUNCIL ORGANIZATIONAL COMMITTEE (ended 4/2017),Member,Alternate Common Council Member,2013-04-30,2014-04-29
1718,283,ADMINISTRATIVE REVIEW BOARD,Member,Alternate Common Council Member,2013-04-30,2014-04-15
1718,10,COMMON COUNCIL ORGANIZATIONAL COMMITTEE (ended 4/2017),Member,Common Council Member,2014-05-06,2017-04-18
1718,308,AD HOC LANDMARKS ORDINANCE REVIEW COMMITTEE,Member,Council President Recommendation (Alder),2014-05-06,2019-04-16
1718,42,COMMUNITY SERVICES COMMITTEE (ended 3/2025),Member,Common Council Member,2015-04-21,2021-04-20
1718,1327,PRESIDENT'S WORK GROUP ON POLICE & COMMUNITY RELATIONS (ended 5/2017),Member,Common Council Member,2017-04-18,2017-05-17
1718,1325,COMMON COUNCIL EXECUTIVE COMMITTEE,Member,Common Council Member,2017-05-02,2019-04-16
1718,307,COMMUNITY DEVELOPMENT DIVISION CONFERENCE COMMITTEE,Member,CSC Alder,2017-06-20,2021-04-20
1718,1339,JOINT CAMPUS AREA COMMITTEE,Member,District 5 Alder,2018-04-17,2021-04-20
1718,1324,FINANCE COMMITTEE,Member,Common Council President,2019-04-17,2020-04-21
1718,241,"ERLANGER, JEFFREY CLAY, CIVILITY IN PUBLIC DISCOURSE AWARD COMMITTEE",Member,Common Council President,2019-04-16,2020-04-21
1718,1325,COMMON COUNCIL EXECUTIVE COMMITTEE,Member,Common Council President,2019-04-30,2020-04-21
1718,1325,COMMON COUNCIL EXECUTIVE COMMITTEE,Member,Alternate - Immediate Past Common Council President,2020-04-21,2021-04-20
1718,1358,ALDER WORKGROUP TO DEVELOP LOGISTICS & OPERATIONAL DETAILS FOR MPD INDEPENDENT CIVILIAN OVERSIGHT (ended 8/2020),Member,Common Council Member,2020-06-16,2020-08-03
1718,1324,FINANCE COMMITTEE,Member,Common Council Member,2020-10-06,2021-04-20
1718,1365,PRESIDENT'S WORK GROUP TO REVIEW AND REVISE THE CHIEF OF STAFF POSITION DESCRIPTION (ended 10/2021),Member,Common Council Member,2021-01-04,2021-04-20
1718,1367,MADISON GUARANTEED INCOME PILOT PROGRAM ADVISORY TASK FORCE,Member,Mayoral Designee,2021-04-20,2027-04-20
1718,42,COMMUNITY SERVICES COMMITTEE (ended 3/2025),Member,Community Representative,2021-06-01,2025-03-11
1718,1385,COMMUNITY RESOURCES COMMITTEE,Member,Neighborhood Engagement/Community Well-being Representative,2025-10-28,2028-04-18
3219,142,EAST WASHINGTON/CAPITOL GATEWAY BUILD STEERING COMMITTEE(prior to 01/20/2010) ,Member,,2009-04-21,2010-01-20
3219,50,HOUSING COMMITTEE (ended 6/2012),Member,,2009-04-21,2012-06-12
3219,52,LANDMARKS COMMISSION,Member,,2009-04-21,2011-04-18
3219,109,PEDESTRIAN/BICYCLE/MOTOR VEHICLE COMMISSION (ended 6/2018),Member,,2009-04-21,2011-04-30
3219,258,SISTER CITY COLLABORATION COMMITTEE (prior to 9/7/2010),Member,,2009-04-21,2010-09-07
3219,199,LANDLORD AND TENANT ISSUES SUBCOMMITTEE (ended 6/2012),Member,,2009-04-21,2012-06-12
3219,165,STATE STREET DESIGN PROJECT OVERSIGHT COMMITTEE (ended 12/12/2013),Member,,2009-06-16,2013-04-15
3219,272,MADISON CITY CHANNEL AD HOC ADVISORY COMMITTEE (ended 8/2010),Member,District 13 Alder,2010-03-16,2010-08-31
3219,274,SISTER CITY AD HOC PLANNING COMMITTEE (ended 2/2011),Member,,2010-09-07,2011-02-01
3219,280,SISTER CITY COLLABORATION COMMITTEE,Member,Common Council Member,2011-02-01,2013-02-01
3219,31,ADA TRANSIT SUBCOMMITTEE TO THE TRANSIT AND PARKING COMM (ended 6/2018),Member,Common Council Member,2011-04-19,2013-04-15
3219,16,TRANSIT AND PARKING COMMISSION (ended 06/2018),Member,Common Council Member,2011-04-19,2013-04-15
3219,109,PEDESTRIAN/BICYCLE/MOTOR VEHICLE COMMISSION (ended 6/2018),Member,Common Council Member,2011-05-01,2013-04-15
3219,53,LONG RANGE TRANSPORTATION PLANNING COMMITTEE (ended 6/2018),Member,,2011-10-18,2012-09-13
3219,39,CITY-COUNTY LIAISON COMMITTEE,Member,Common Council Member,2012-08-07,2013-04-15
3219,295,EAST WASHINGTON AVENUE 800 BLOCK NORTH COMMITTEE (ended 4/2013),Member,Common Council Member,2012-10-30,2013-04-09
3218,39,CITY-COUNTY LIAISON COMMITTEE,Member,,2009-04-21,2011-04-18
3218,236,MADISON AREA TRANSPORTATION PLANNING BOARD (MPO) (prior to 9/30/2023),Member,Elected Official,2009-04-21,2018-09-03
3218,60,SOLID WASTE ADVISORY COMMITTEE (ended 3/2020),Member,Common Council Member,2009-04-21,2015-04-21
3218,246,ZONING CODE REWRITE ADVISORY COMMITTEE (ended 2/2013),Member,Common Council Member,2009-04-21,2013-02-05
3218,53,LONG RANGE TRANSPORTATION PLANNING COMMITTEE (ended 6/2018),Member,,2009-06-02,2017-04-30
3218,14,PUBLIC SAFETY REVIEW COMMITTEE,Member,,2010-11-09,2011-04-18
3218,277,REAPPORTIONMENT & REDISTRICTING AD HOC COMMITTEE (ended 8/2011),Member,District 13 Alder,2011-02-01,2011-08-02
3218,3,PLAN COMMISSION,Member,Common Council Member,2011-05-01,2019-04-16
3218,10,COMMON COUNCIL ORGANIZATIONAL COMMITTEE (ended 4/2017),Member,,2011-05-03,2012-04-17
3218,95,COMMUNITY GARDENS COMMITTEE (ended 12/2016),Member,Plan Commission Member,2013-05-07,2015-07-21
3218,308,AD HOC LANDMARKS ORDINANCE REVIEW COMMITTEE,Member,Plan Commission Member (Alder),2014-05-06,2017-03-20
3218,47,ECONOMIC DEVELOPMENT COMMITTEE,Member,Common Council Member,2015-04-21,2019-04-16
3218,156,MONONA TERRACE BOOKING EVENT ASSISTANCE ADVISORY COMMITTEE,Member,Common Council Member,2015-04-21,2019-04-16
3218,95,COMMUNITY GARDENS COMMITTEE (ended 12/2016),Member,Plan Commission Member,2015-09-15,2016-12-15
3218,1320,TRANSPORTATION ORDINANCE REVIEW AD HOC COMMITTEE - ended 7/2017,Member,,2016-02-23,2017-07-14
3218,308,AD HOC LANDMARKS ORDINANCE REVIEW COMMITTEE,Member,Economic Development Committee Member (Alder),2017-03-21,2019-04-16
3218,53,LONG RANGE TRANSPORTATION PLANNING COMMITTEE (ended 6/2018),Member,,2017-07-11,2018-06-30
3218,1330,OSCAR MAYER STRATEGIC ASSESSMENT COMMITTEE (ended 2/2019),Member,Common Council Member,2017-10-03,2019-02-05
3218,1348,TRANSPORTATION COMMISSION,Member,Common Council Member,2018-06-19,2019-04-16
3220,44,DOWNTOWN COORDINATING COMMITTEE,Member,,2009-04-21,2011-04-18
3220,152,JOINT SOUTHEAST CAMPUS AREA COMMITTEE (ended 3/2018),Member,,2009-04-21,2011-04-18
3220,109,PEDESTRIAN/BICYCLE/MOTOR VEHICLE COMMISSION (ended 6/2018),Member,,2009-04-21,2011-04-30
3220,14,PUBLIC SAFETY REVIEW COMMITTEE,Member,,2009-04-21,2011-04-18
3220,10,COMMON COUNCIL ORGANIZATIONAL COMMITTEE (ended 4/2017),Member,,2009-05-05,2011-04-18
3220,165,STATE STREET DESIGN PROJECT OVERSIGHT COMMITTEE (ended 12/12/2013),Member,,2009-06-16,2011-04-18
3220,262,COMPLETE COUNT COMMITTEE (ended 5/2010),Member,District 13 Alder,2009-10-06,2010-10-01
3421,273,OVERTURE AD HOC COMMITTEE (ended 12/2010),Member,,2010-08-03,2010-12-31
3421,2,Mayor,Member,Mayor,2011-04-19,2015-04-21
3421,4,BOARD OF ESTIMATES (ended 4/2017),Chair,Mayor,2011-04-19,2017-04-18
3421,1324,FINANCE COMMITTEE,Member,Mayor,2011-04-19,2019-04-16
2315,161,SECTION 8 ADVISORY COMMITTEE (prior to 5-4-2006),Member,,2004-06-01,2007-11-18
2315,137,CDA HOUSING OPERATIONS SUBCOMMITTEE (prior to 9-15-2009),Member,,2005-06-21,2009-09-01
2315,217,SOUTHWEST NEIGHBORHOOD STEERING COMMITTEE (prior to 1-22-2008),Member,,2006-11-07,2008-02-04
2315,261,LOW INCOME BUS PASS PROGRAM COMMITTEE (ended 6/2010),Member,,2009-07-07,2010-06-01
2315,42,COMMUNITY SERVICES COMMITTEE (ended 3/2025),Member,,2009-10-01,2011-04-18
2315,48,EQUAL OPPORTUNITIES COMMISSION,Member,,2010-07-20,2011-04-19
2315,5,ALCOHOL LICENSE REVIEW COMMITTEE,Member,Common Council Member,2011-04-19,2015-04-21
2315,42,COMMUNITY SERVICES COMMITTEE (ended 3/2025),Member,Common Council or Citizen Member,2011-04-19,2015-04-21
2315,16,TRANSIT AND PARKING COMMISSION (ended 06/2018),Member,Common Council Member,2011-04-19,2013-04-15
2315,109,PEDESTRIAN/BICYCLE/MOTOR VEHICLE COMMISSION (ended 6/2018),Member,Common Council Member,2011-05-01,2013-04-15
2315,31,ADA TRANSIT SUBCOMMITTEE TO THE TRANSIT AND PARKING COMM (ended 6/2018),Member,Common Council Member,2013-04-16,2015-04-21
2315,4,BOARD OF ESTIMATES (ended 4/2017),Member,Common Council Member,2013-04-16,2015-04-21
2315,257,COMMITTEE ON SWEATFREE PURCHASES (Ended 6-2024),Member,Board of Estimates Member (Alder),2014-01-21,2015-04-21
3340,152,JOINT SOUTHEAST CAMPUS AREA COMMITTEE (ended 3/2018),Member,,2009-11-17,2011-04-18
3340,44,DOWNTOWN COORDINATING COMMITTEE,Member,Common Council Member,2011-04-19,2013-04-15
3340,47,ECONOMIC DEVELOPMENT COMMITTEE,Member,Common Council Member,2011-04-19,2015-04-21
3340,50,HOUSING COMMITTEE (ended 6/2012),Member,,2011-04-19,2012-06-12
3340,152,JOINT SOUTHEAST CAMPUS AREA COMMITTEE (ended 3/2018),Member,District 8 Alder,2011-04-19,2015-04-21
3340,54,MADISON CULTURAL ARTS DISTRICT BOARD,Member,Common Council Member,2011-04-19,2015-04-21
3340,263,VENDING OVERSIGHT COMMITTEE,Member,Common Council Member - Voting,2011-04-19,2015-04-21
3340,165,STATE STREET DESIGN PROJECT OVERSIGHT COMMITTEE (ended 12/12/2013),Member,District 8 Alder,2011-04-19,2013-12-12
3340,285,AD HOC COMMITTEE ON MOPED PARKING (ended 8/2017),Member,,2012-03-06,2015-04-21
3340,298,LANDLORD AND TENANT ISSUES COMMITTEE (end 11/2024),Member,Common Council Member,2013-02-26,2015-04-21
3340,39,CITY-COUNTY LIAISON COMMITTEE,Member,Common Council Member,2013-04-16,2015-04-21
3340,3,PLAN COMMISSION,Member,Common Council Member,2013-04-16,2015-04-21
3340,10,COMMON COUNCIL ORGANIZATIONAL COMMITTEE (ended 4/2017),Member,Common Council President Pro Tem,2013-04-30,2014-04-29
3340,283,ADMINISTRATIVE REVIEW BOARD,Member,Common Council President Pro Tem,2013-04-30,2014-04-15
3340,306,DIGITAL TECHNOLOGY COMMITTEE (ended 11-2021),Member,Common Council Member,2013-12-03,2015-04-21
3340,106,MADISON DEVELOPMENT CORPORATION BOARD OF DIRECTORS,Member,Economic Development Experience or EDC Representative,2019-10-15,2023-10-16
3340,106,MADISON DEVELOPMENT CORPORATION BOARD OF DIRECTORS,Member,Mayor or Designee,2023-10-17,2026-06-04
2971,48,EQUAL OPPORTUNITIES COMMISSION,Member,,2007-07-03,2008-06-12
2971,113,BAYVIEW FOUNDATION BOARD,Member,,2011-04-19,2013-04-15
2971,91,COMMUNITY DEVELOPMENT AUTHORITY,Member,Common Council Member,2011-04-19,2014-03-20
2971,152,JOINT SOUTHEAST CAMPUS AREA COMMITTEE (ended 3/2018),Member,District 13 Alder,2011-04-19,2014-03-20
2971,153,JOINT WEST CAMPUS AREA COMMITTEE (ended 3/2018),Member,District 13 Alder,2011-04-19,2014-03-20
2971,132,ZOO COMMISSION - HENRY VILAS,Member,Common Council Member-Zoo District,2011-04-19,2014-03-20
2971,10,COMMON COUNCIL ORGANIZATIONAL COMMITTEE (ended 4/2017),Member,,2011-05-03,2012-04-17
2971,264,CDA HOUSING OPERATIONS SUBCOMMITTEE,Member,Common Council Member,2011-07-14,2014-03-20
2971,36,WATER UTILITY BOARD,Member,Council Member or Member,2012-02-07,2013-04-15
2971,10,COMMON COUNCIL ORGANIZATIONAL COMMITTEE (ended 4/2017),Member,,2012-05-01,2013-04-16
2971,297,TIF POLICY REVIEW AD HOC COMMITTEE (ended 4/2014),Member,Community Development Authority Member (Alder),2013-01-22,2014-03-20
2971,299,HOUSING STRATEGY COMMITTEE (end 11/2024),Member,Common Council Member,2013-02-26,2014-03-20
2971,40,COMMITTEE ON THE ENVIRONMENT (ended 6/2020),Member,Common Council Member,2013-04-16,2014-03-20
2971,16,TRANSIT AND PARKING COMMISSION (ended 06/2018),Member,Common Council Member,2013-04-16,2014-03-20
2971,113,BAYVIEW FOUNDATION BOARD,Member,Mayoral Representative,2014-02-04,2014-03-20
3477,47,ECONOMIC DEVELOPMENT COMMITTEE,Member,,2011-04-19,2013-04-15
3477,149,HO-CHUNK NATION/CITY OF MADISON JOINT PLANNING COMMITTEE,Member,,2011-04-19,2013-04-15
3477,14,PUBLIC SAFETY REVIEW COMMITTEE,Member,Common Council Member,2011-04-19,2013-04-15
3477,195,SUSTAINABLE DESIGN AND ENERGY COMMITTEE (ended 6/2012),Member,,2011-04-19,2012-06-12
3477,109,PEDESTRIAN/BICYCLE/MOTOR VEHICLE COMMISSION (ended 6/2018),Member,Common Council Member,2011-05-01,2013-04-15
3477,291,SUSTAINABLE MADISON COMMITTEE,Member,Common Council or Citizen Member,2011-04-19,2013-04-16
3477,292,PAYMENTS IN LIEU OF TAXES (PILOT) TASK FORCE (ended 8/2013),Member,Common Council Member,2012-07-17,2013-04-15
3478,45,EARLY CHILDHOOD CARE AND EDUCATION COMMITTEE,Member,Common Council Member,2011-04-19,2013-04-15
3478,40,COMMITTEE ON THE ENVIRONMENT (ended 6/2020),Member,Common Council Member,2011-04-19,2013-04-15
3478,9,BOARD OF PUBLIC WORKS,Member,Common Council Member,2011-04-19,2013-04-15
3478,224,WARNER PARK COMMUNITY RECREATION CENTER ADVISORY SUBCOMMITTEE (ended 3-2023),Member,District 18 Alder,2011-04-19,2015-04-21
3478,284,MADISON LOCAL FOOD COMMITTEE (renamed Public Market Development Committee 12/2016),Member,Common Council Member,2011-09-06,2015-04-21
3478,299,HOUSING STRATEGY COMMITTEE (end 11/2024),Member,Common Council Member,2013-02-26,2013-04-15
3478,115,COMMUNITY ACTION COALITION FOR SOUTH CENTRAL WISCONSIN INC (ended 1-2020),Member,Mayor or Designee,2013-04-16,2013-05-22
3478,48,EQUAL OPPORTUNITIES COMMISSION,Member,Common Council Member,2013-04-16,2015-04-21
3478,16,TRANSIT AND PARKING COMMISSION (ended 06/2018),Member,Common Council Member,2013-04-16,2015-04-21
3478,36,WATER UTILITY BOARD,Member,Council Member or Member,2013-04-16,2015-04-21
3478,10,COMMON COUNCIL ORGANIZATIONAL COMMITTEE (ended 4/2017),Member,Common Council Member,2013-04-30,2015-04-21
3478,283,ADMINISTRATIVE REVIEW BOARD,Member,Common Council Member,2013-04-30,2014-04-15
3478,299,HOUSING STRATEGY COMMITTEE (end 11/2024),Member,Common Council Member,2014-04-29,2015-04-21
3289,45,EARLY CHILDHOOD CARE AND EDUCATION COMMITTEE,Member,,2009-09-15,2009-09-23
3289,14,PUBLIC SAFETY REVIEW COMMITTEE,Member,,2010-01-05,2011-04-18
3289,127,SENSITIVE CRIMES COMMISSION (Dane County),Member,Public Safety Review Committee Representative,2010-09-21,2013-06-30
3289,41,COMMUNITY DEVELOPMENT BLOCK GRANT COMMITTEE,Member,Common Council or Resident Member,2011-04-19,2019-04-16
3289,103,BOARD OF EDUCATION - COMMON COUNCIL LIAISON COMMITTEE (prior to 6/12/2012),Member,District 13 Alder,2011-04-19,2012-06-12
3289,186,BOARD OF HEALTH FOR MADISON AND DANE COUNTY,Member,Common Council Member,2011-04-19,2019-04-16
3289,14,PUBLIC SAFETY REVIEW COMMITTEE,Member,Common Council Member,2011-04-19,2013-04-15
3289,95,COMMUNITY GARDENS COMMITTEE (ended 12/2016),Member,,2011-09-06,2012-10-08
3289,10,COMMON COUNCIL ORGANIZATIONAL COMMITTEE (ended 4/2017),Member,Common Council Member,2012-05-01,2014-04-29
3289,289,EDUCATION COMMITTEE (prior to 10/1/2023),Member,Common Council Member,2011-04-19,2019-04-16
3289,294,MADISON FOOD POLICY COUNCIL,Member,Common Council Member,2012-10-16,2015-04-21
3289,283,ADMINISTRATIVE REVIEW BOARD,Member,Common Council Member,2012-05-01,2014-04-15
3289,307,COMMUNITY DEVELOPMENT DIVISION CONFERENCE COMMITTEE,Member,CDBG Alder,2015-02-24,2017-04-18
3289,303,SUSTAINABLE MADISON TRANSPORTATION MASTER PLAN OVERSIGHT COMMITTEE (Madison in Motion) (ended 2/2017),Member,Common Council Member,2015-04-21,2017-02-28
3289,10,COMMON COUNCIL ORGANIZATIONAL COMMITTEE (ended 4/2017),Member,Common Council Member,2015-05-05,2016-04-19
3289,32,AFFIRMATIVE ACTION COMMISSION,Member,Common Council Member,2017-04-18,2019-04-16
3289,1325,COMMON COUNCIL EXECUTIVE COMMITTEE,Member,Common Council Member,2017-05-02,2018-04-17
3289,41,COMMUNITY DEVELOPMENT BLOCK GRANT COMMITTEE,Member,Resident Member,2019-12-03,2022-06-07
3289,41,COMMUNITY DEVELOPMENT BLOCK GRANT COMMITTEE,Member,Common Council or Resident Member,2022-06-21,2023-04-18
3289,45,EARLY CHILDHOOD CARE AND EDUCATION COMMITTEE,Member,Common Council Member,2022-06-21,2022-09-02
3289,186,BOARD OF HEALTH FOR MADISON AND DANE COUNTY,Member,Common Council Member,2022-06-21,2023-04-18
3289,1355,BUDGET COMMITTEE - BOARD OF HEALTH FOR MADISON AND DANE COUNTY,Member,Common Council Member,2022-06-21,2023-04-18
3289,41,COMMUNITY DEVELOPMENT BLOCK GRANT COMMITTEE,Member,Second Alternate,2023-08-01,2026-01-01
3289,1339,JOINT CAMPUS AREA COMMITTEE,Member,UW-Health Representative,2025-10-03,
2405,44,DOWNTOWN COORDINATING COMMITTEE,Member,Citizen Member,2003-02-04,2013-04-15
2405,155,MID-STATE STREET PARKING RAMP COMMITTEE (prior to 11-15-2004),Member,,2004-07-01,2004-11-16
2405,246,ZONING CODE REWRITE ADVISORY COMMITTEE (ended 2/2013),Member,,2008-03-04,2013-02-05
2405,44,DOWNTOWN COORDINATING COMMITTEE,Member,Common Council Member,2013-04-16,2019-04-16
2405,294,MADISON FOOD POLICY COUNCIL,Member,Common Council Member,2013-04-16,2019-04-16
2405,3,PLAN COMMISSION,Member,Common Council Member,2013-04-16,2019-04-16
2405,165,STATE STREET DESIGN PROJECT OVERSIGHT COMMITTEE (ended 12/12/2013),Member,District 2 Alder,2013-04-16,2013-12-12
2405,152,JOINT SOUTHEAST CAMPUS AREA COMMITTEE (ended 3/2018),Member,District 2 Alder,2013-05-29,2018-03-29
2405,310,CAPITOL EAST DISTRICT COMMITTEE (ended 2/2017),Member,District 2 Alder,2014-09-02,2017-02-10
2405,109,PEDESTRIAN/BICYCLE/MOTOR VEHICLE COMMISSION (ended 6/2018),Member,Common Council Member,2015-04-21,2018-06-30
2405,10,COMMON COUNCIL ORGANIZATIONAL COMMITTEE (ended 4/2017),Member,Common Council Member,2015-05-05,2017-04-18
2405,1320,TRANSPORTATION ORDINANCE REVIEW AD HOC COMMITTEE - ended 7/2017,Member,,2016-02-23,2017-07-14
2405,16,TRANSIT AND PARKING COMMISSION (ended 06/2018),Member,Common Council Member,2016-05-03,2017-04-18
2405,14,PUBLIC SAFETY REVIEW COMMITTEE,Member,Common Council Member,2017-04-18,2019-04-16
2405,308,AD HOC LANDMARKS ORDINANCE REVIEW COMMITTEE,Member,Plan Commission Member (Alder),2017-03-21,2019-04-16
2405,1337,PRESIDENT'S WORK GROUP TO DEVELOP CITY-WIDE SURVEILLANCE EQUIPMENT & DATA MANAGEMENT POLICIES (ended 1/2020),Member,Common Council Member,2017-12-29,2019-04-16
2405,1335,HISTORIC PRESERVATION PLAN ADVISORY COMMITTEE (ended 5/2020),Member,LORC Common Council Member,2018-02-06,2019-04-16
2405,1347,TRANSPORTATION POLICY AND PLANNING BOARD - ended 3/2023,Member,Common Council Member,2018-06-19,2019-04-16
2405,3,PLAN COMMISSION,Member,Mayor or Designee,2019-07-16,2024-10-07
2405,1337,PRESIDENT'S WORK GROUP TO DEVELOP CITY-WIDE SURVEILLANCE EQUIPMENT & DATA MANAGEMENT POLICIES (ended 1/2020),Member,Adult City Resident,2019-08-06,2019-12-31
2405,1337,PRESIDENT'S WORK GROUP TO DEVELOP CITY-WIDE SURVEILLANCE EQUIPMENT & DATA MANAGEMENT POLICIES (ended 1/2020),Member,Member,2019-11-19,2020-01-31
3468,14,PUBLIC SAFETY REVIEW COMMITTEE,Member,Citizen Member,2011-02-22,2013-04-15
3468,184,ALLIED AREA TASK FORCE,Member,District 10 Alder,2013-04-16,2019-04-16
3468,41,COMMUNITY DEVELOPMENT BLOCK GRANT COMMITTEE,Member,Common Council Member,2013-04-16,2019-04-16
3468,109,PEDESTRIAN/BICYCLE/MOTOR VEHICLE COMMISSION (ended 6/2018),Member,Common Council Member,2013-04-16,2015-04-21
3468,14,PUBLIC SAFETY REVIEW COMMITTEE,Member,Common Council Member,2013-04-16,2016-05-16
3468,303,SUSTAINABLE MADISON TRANSPORTATION MASTER PLAN OVERSIGHT COMMITTEE (Madison in Motion) (ended 2/2017),Member,Common Council Member,2013-08-06,2017-02-28
3468,10,COMMON COUNCIL ORGANIZATIONAL COMMITTEE (ended 4/2017),Member,Common Council Member,2014-05-06,2015-04-21
3468,310,CAPITOL EAST DISTRICT COMMITTEE (ended 2/2017),Member,Alder-At-Large,2014-09-02,2015-04-21
3468,4,BOARD OF ESTIMATES (ended 4/2017),Member,Common Council Member,2015-04-21,2017-04-18
3468,10,COMMON COUNCIL ORGANIZATIONAL COMMITTEE (ended 4/2017),Member,Common Council President Pro Tem,2015-04-21,2016-04-19
3468,257,COMMITTEE ON SWEATFREE PURCHASES (Ended 6-2024),Member,Board of Estimates Member (Alder),2015-08-04,2017-04-18
3468,10,COMMON COUNCIL ORGANIZATIONAL COMMITTEE (ended 4/2017),Member,Common Council Member,2016-05-03,2017-04-18
3468,319,CITY-COUNTY HOMELESS ISSUES COMMITTEE,Member,Common Council Member,2017-04-18,2019-04-16
3468,26,BOARD OF PARK COMMISSIONERS,Member,Common Council Member,2017-04-18,2019-04-16
3742,39,CITY-COUNTY LIAISON COMMITTEE,Member,Common Council Member,2013-04-16,2015-04-21
3742,47,ECONOMIC DEVELOPMENT COMMITTEE,Member,Common Council Member,2013-04-16,2015-04-21
3742,284,MADISON LOCAL FOOD COMMITTEE (renamed Public Market Development Committee 12/2016),Member,Common Council Member,2013-04-16,2015-04-21
3742,109,PEDESTRIAN/BICYCLE/MOTOR VEHICLE COMMISSION (ended 6/2018),Member,Common Council Member,2013-04-16,2015-04-21
3742,14,PUBLIC SAFETY REVIEW COMMITTEE,Member,Common Council Member,2013-04-16,2015-04-21
3742,303,SUSTAINABLE MADISON TRANSPORTATION MASTER PLAN OVERSIGHT COMMITTEE (Madison in Motion) (ended 2/2017),Member,Common Council Member,2013-08-06,2015-04-21
3743,9,BOARD OF PUBLIC WORKS,Member,Common Council Member,2013-04-16,2015-04-21
3743,236,MADISON AREA TRANSPORTATION PLANNING BOARD (MPO) (prior to 9/30/2023),Member,Elected Official,2013-04-16,2019-04-16
3743,296,PERFORMING ARTS STUDY STEERING COMMITTEE (ended 10/2014),Member,Common Council Member,2013-04-16,2014-10-02
3743,291,SUSTAINABLE MADISON COMMITTEE,Member,Common Council Member,2013-04-16,2019-04-16
3743,10,COMMON COUNCIL ORGANIZATIONAL COMMITTEE (ended 4/2017),Member,Common Council Member,2013-04-30,2015-04-21
3743,283,ADMINISTRATIVE REVIEW BOARD,Member,Common Council Member,2013-04-30,2014-04-15
3743,115,COMMUNITY ACTION COALITION FOR SOUTH CENTRAL WISCONSIN INC (ended 1-2020),Member,Mayoral Appointee,2013-10-01,2020-07-21
3743,309,GARVER FEED MILL CRITERIA  AND SELECTION COMMITTEE (ended 4/2015),Member,Common Council Member,2014-05-06,2015-04-21
3743,16,TRANSIT AND PARKING COMMISSION (ended 06/2018),Member,Common Council Member,2015-04-21,2018-06-30
3743,36,WATER UTILITY BOARD,Member,Council Member or Member,2015-04-21,2019-04-16
3743,44,DOWNTOWN COORDINATING COMMITTEE,Member,,2017-04-18,2019-04-16
3743,1331,URBAN FORESTRY TASK FORCE (ended 1/2020),Member,Common Council Member,2017-10-31,2019-04-16
3743,1325,COMMON COUNCIL EXECUTIVE COMMITTEE,Member,Common Council Member,2018-05-01,2019-04-16
3743,1347,TRANSPORTATION POLICY AND PLANNING BOARD - ended 3/2023,Member,Common Council Member,2018-06-19,2019-04-16
3743,1336,TASK FORCE ON STRUCTURE OF CITY GOVERNMENT (ended 3/2020),Member,Common Council Member,2018-08-07,2019-04-16
3744,42,COMMUNITY SERVICES COMMITTEE (ended 3/2025),Member,Common Council Member,2013-04-16,2015-04-21
3744,45,EARLY CHILDHOOD CARE AND EDUCATION COMMITTEE,Member,Common Council Member,2013-04-16,2018-06-30
3744,149,HO-CHUNK NATION/CITY OF MADISON JOINT PLANNING COMMITTEE,Member,Mayoral Appointee,2013-04-16,2018-06-30
3744,292,PAYMENTS IN LIEU OF TAXES (PILOT) TASK FORCE (ended 8/2013),Member,Common Council Member,2013-04-16,2013-08-06
3744,4,BOARD OF ESTIMATES (ended 4/2017),Member,Common Council Member,2013-04-16,2015-04-21
3744,303,SUSTAINABLE MADISON TRANSPORTATION MASTER PLAN OVERSIGHT COMMITTEE (Madison in Motion) (ended 2/2017),Member,Common Council Member,2013-08-06,2015-04-21
3744,304,LAMP HOUSE BLOCK AD HOC PLAN COMMITTEE (ended 3/2014),Member,Common Council Member,2013-09-17,2014-03-04
3744,307,COMMUNITY DEVELOPMENT DIVISION CONFERENCE COMMITTEE,Member,CSC Alder,2014-02-25,2015-04-21
3744,10,COMMON COUNCIL ORGANIZATIONAL COMMITTEE (ended 4/2017),Member,Common Council President Pro Tem,2014-05-06,2015-04-21
3744,314,COMMITTEE ON EMPLOYEE RELATIONS,Member,Board of Estimates Member (Alder),2015-03-17,2016-04-19
3744,4,BOARD OF ESTIMATES (ended 4/2017),Member,Common Council President,2015-04-21,2016-04-19
3744,47,ECONOMIC DEVELOPMENT COMMITTEE,Member,Common Council Member,2015-04-21,2018-06-30
3744,241,"ERLANGER, JEFFREY CLAY, CIVILITY IN PUBLIC DISCOURSE AWARD COMMITTEE",Member,Common Council President,2015-04-21,2016-04-19
3744,10,COMMON COUNCIL ORGANIZATIONAL COMMITTEE (ended 4/2017),Member,Common Council Member,2015-04-21,2016-04-19
3744,1320,TRANSPORTATION ORDINANCE REVIEW AD HOC COMMITTEE - ended 7/2017,Member,Common Council President,2016-02-23,2017-07-14
3744,10,COMMON COUNCIL ORGANIZATIONAL COMMITTEE (ended 4/2017),Member,Alternate Common Council Member,2016-05-03,2017-04-18
3744,9,BOARD OF PUBLIC WORKS,Member,Common Council Member,2017-04-18,2018-06-30
3744,1327,PRESIDENT'S WORK GROUP ON POLICE & COMMUNITY RELATIONS (ended 5/2017),Member,Common Council Member,2017-04-18,2017-05-17
3744,1325,COMMON COUNCIL EXECUTIVE COMMITTEE,Member,Common Council Member,2017-05-02,2018-04-17
3744,291,SUSTAINABLE MADISON COMMITTEE,Member,Board of Public Works Representative,2017-06-06,2018-06-30
3744,291,SUSTAINABLE MADISON COMMITTEE,Member,Resident Member,2018-09-25,2024-01-11
3119,9,BOARD OF PUBLIC WORKS,Member,,2008-06-03,2010-09-06
3119,195,SUSTAINABLE DESIGN AND ENERGY COMMITTEE (ended 6/2012),Member,,2009-06-02,2012-07-30
3119,266,SUSTAINABLE CITY AD HOC SUBCOMMITTEE FOR THE PUBLIC SECTOR (ended 3/2011),Member,,2009-10-20,2011-03-24
3119,40,COMMITTEE ON THE ENVIRONMENT (ended 6/2020),Member,,2010-05-18,2010-06-03
3119,9,BOARD OF PUBLIC WORKS,Vice Chair,Mayor or Designee,2010-09-07,2012-12-26
3119,53,LONG RANGE TRANSPORTATION PLANNING COMMITTEE (ended 6/2018),Member,Board of Public Works Representative,2010-09-21,2012-12-26
3119,291,SUSTAINABLE MADISON COMMITTEE,Member,Board of Public Works Representative,2009-06-02,2012-12-26
3119,113,BAYVIEW FOUNDATION BOARD,Member,Mayoral Representative,2014-05-06,2015-04-21
3119,40,COMMITTEE ON THE ENVIRONMENT (ended 6/2020),Member,Common Council Member,2014-05-06,2015-04-21
3119,91,COMMUNITY DEVELOPMENT AUTHORITY,Member,Common Council Member,2014-05-06,2015-04-21
3119,152,JOINT SOUTHEAST CAMPUS AREA COMMITTEE (ended 3/2018),Member,District 13 Alder,2014-05-06,2015-04-21
3119,153,JOINT WEST CAMPUS AREA COMMITTEE (ended 3/2018),Member,District 13 Alder,2014-05-06,2015-04-21
3119,16,TRANSIT AND PARKING COMMISSION (ended 06/2018),Member,Common Council Member,2014-05-06,2015-04-21
3119,132,ZOO COMMISSION - HENRY VILAS,Member,Common Council Member-Zoo District,2014-05-06,2015-04-21
3902,14,PUBLIC SAFETY REVIEW COMMITTEE,Member,Citizen Member,2014-10-21,2015-04-21
3902,32,AFFIRMATIVE ACTION COMMISSION,Member,Common Council Member,2015-04-21,2017-04-18
3902,113,BAYVIEW FOUNDATION BOARD,Member,Mayoral Representative,2015-04-21,2018-08-06
3902,4,BOARD OF ESTIMATES (ended 4/2017),Member,Common Council Member,2015-04-21,2017-04-18
3902,310,CAPITOL EAST DISTRICT COMMITTEE (ended 2/2017),Member,Alder-At-Large,2015-04-21,2017-04-18
3902,91,COMMUNITY DEVELOPMENT AUTHORITY,Member,Common Council Member,2015-04-21,2018-08-06
3902,152,JOINT SOUTHEAST CAMPUS AREA COMMITTEE (ended 3/2018),Member,District 13 Alder,2015-04-21,2018-03-29
3902,153,JOINT WEST CAMPUS AREA COMMITTEE (ended 3/2018),Member,District 13 Alder,2015-04-21,2018-03-29
3902,132,ZOO COMMISSION - HENRY VILAS,Member,Common Council Member-Zoo District,2015-04-21,2018-08-06
3902,1324,FINANCE COMMITTEE,Member,Common Council Member,2015-04-21,2018-08-06
3902,42,COMMUNITY SERVICES COMMITTEE (ended 3/2025),Member,Common Council or Citizen Member,2017-04-18,2018-08-06
3902,1336,TASK FORCE ON STRUCTURE OF CITY GOVERNMENT (ended 3/2020),Member,Common Council Member,2018-02-06,2018-08-06
3902,1338,TRUMAN OLSON SELECTION COMMITTEE (ended 5-2019),Member,Common Council Member,2018-04-05,2018-08-06
3902,1339,JOINT CAMPUS AREA COMMITTEE,Member,District 13 Alder - Non-Voting,2018-04-17,2018-08-06
3050,246,ZONING CODE REWRITE ADVISORY COMMITTEE (ended 2/2013),Member,,2008-02-26,2013-02-05
3050,247,"NEIGHBORHOOD SUPPORT OFFICE, ADVISORY COMMITTEE TO GUIDE DEVELOPMENT & IMPLEMENTATION OF THE (prior to 1-2009)",Member,,2008-04-22,2009-01-02
3050,93,MADISON PUBLIC LIBRARY BOARD,Member,Adult City Resident,2012-05-15,2015-04-20
3050,39,CITY-COUNTY LIAISON COMMITTEE,Member,Common Council Member,2015-04-21,2019-04-16
3050,91,COMMUNITY DEVELOPMENT AUTHORITY,Member,Common Council Member,2015-04-21,2023-04-18
3050,12,MADISON ARTS COMMISSION,Member,Common Council Member,2015-04-21,2023-04-18
3050,3,PLAN COMMISSION,Member,Common Council Member,2015-04-21,2019-04-16
3050,64,URBAN DESIGN COMMISSION,Member,Common Council Member,2015-04-21,2017-04-18
3050,36,WATER UTILITY BOARD,Member,Common Council Member,2015-04-21,2017-04-18
3050,10,COMMON COUNCIL ORGANIZATIONAL COMMITTEE (ended 4/2017),Member,Common Council Member,2016-05-03,2017-04-18
3050,1327,PRESIDENT'S WORK GROUP ON POLICE & COMMUNITY RELATIONS (ended 5/2017),Member,Common Council Member,2017-04-18,2017-05-17
3050,1325,COMMON COUNCIL EXECUTIVE COMMITTEE,Member,Common Council Member,2017-05-02,2018-04-17
3050,1331,URBAN FORESTRY TASK FORCE (ended 1/2020),Member,Common Council Member,2017-10-31,2020-01-21
3050,1336,TASK FORCE ON STRUCTURE OF CITY GOVERNMENT (ended 3/2020),Member,Common Council Member,2018-02-06,2019-04-16
3050,1337,PRESIDENT'S WORK GROUP TO DEVELOP CITY-WIDE SURVEILLANCE EQUIPMENT & DATA MANAGEMENT POLICIES (ended 1/2020),Member,Common Council Member,2017-12-29,2020-01-16
3050,1335,HISTORIC PRESERVATION PLAN ADVISORY COMMITTEE (ended 5/2020),Member,Common Council Member,2018-02-06,2019-04-16
3050,1338,TRUMAN OLSON SELECTION COMMITTEE (ended 5-2019),Member,District 14 Alder,2018-04-05,2019-05-17
3050,1325,COMMON COUNCIL EXECUTIVE COMMITTEE,Member,Common Council Vice President,2018-05-01,2019-04-16
3050,64,URBAN DESIGN COMMISSION,Member,Common Council Member,2019-02-05,2019-04-16
3050,5,ALCOHOL LICENSE REVIEW COMMITTEE,Member,Common Council Member,2019-04-16,2023-04-18
3050,1322,ROOM TAX COMMISSION,Member,Common Council Member,2019-04-16,2023-04-18
3050,1325,COMMON COUNCIL EXECUTIVE COMMITTEE,Member,Common Council Member,2019-04-30,2020-05-01
3050,1324,FINANCE COMMITTEE,Member,Common Council President,2020-04-22,2021-04-20
3050,241,"ERLANGER, JEFFREY CLAY, CIVILITY IN PUBLIC DISCOURSE AWARD COMMITTEE",Member,Common Council President,2020-04-21,2021-04-20
3050,1325,COMMON COUNCIL EXECUTIVE COMMITTEE,Member,Common Council President,2020-04-21,2021-04-20
3050,1324,FINANCE COMMITTEE,Member,Common Council Member,2021-04-20,2023-04-18
3050,1325,COMMON COUNCIL EXECUTIVE COMMITTEE,Member,Alternate - Immediate Past Common Council President,2021-04-20,2022-04-19
3050,1368,"PRESIDENT'S WORK GROUP ON RACIAL JUSTICE, ANTIRACISM AND EQUITY (ended 5/2022)",Member,Common Council Member,2021-05-18,2022-04-19
3050,1365,PRESIDENT'S WORK GROUP TO REVIEW AND REVISE THE CHIEF OF STAFF POSITION DESCRIPTION (ended 10/2021),Member,Common Council Member,2021-04-28,2021-10-22
3050,5,ALCOHOL LICENSE REVIEW COMMITTEE,Member,Adult City Resident,2023-11-07,2025-08-15
3050,56,MONONA TERRACE COMMUNITY AND CONVENTION CENTER BOARD,Member,City Appointee,2025-06-17,2028-05-01
3944,31,ADA TRANSIT SUBCOMMITTEE TO THE TRANSIT AND PARKING COMM (ended 6/2018),Member,Common Council Member,2015-04-21,2017-04-18
3944,4,BOARD OF ESTIMATES (ended 4/2017),Member,Common Council Member,2015-04-21,2017-04-18
3944,93,MADISON PUBLIC LIBRARY BOARD,Member,Common Council Member,2015-04-21,2021-04-20
3944,14,PUBLIC SAFETY REVIEW COMMITTEE,Member,Common Council Member,2015-04-21,2021-04-20
3944,127,SENSITIVE CRIMES COMMISSION (Dane County),Member,Public Safety Review Committee Representative,2017-03-10,2019-06-30
3944,1324,FINANCE COMMITTEE,Member,Common Council Member,2015-04-21,2021-04-20
3944,288,COMMITTEE ON AGING,Member,Common Council Member,2017-10-31,2020-04-20
3944,1325,COMMON COUNCIL EXECUTIVE COMMITTEE,Member,Common Council Member,2018-08-08,2019-04-16
3944,92,DISABILITY RIGHTS COMMISSION,Member,Common Council Member,2019-04-16,2021-04-20
3944,1325,COMMON COUNCIL EXECUTIVE COMMITTEE,Member,Common Council Vice President,2019-04-30,2020-04-21
3944,1353,PRESIDENT'S WORK GROUP TO REVIEW COUNCIL COMMUNICATION TOOLS & PROCESSES,Member,Common Council Member,2019-07-16,2020-06-15
3944,1354,COMPLETE COUNT COMMITTEE (ended 9/2020),Member,Common Council Executive Committee Member,2019-06-18,2020-09-23
3944,1357,PRESIDENT'S WORK GROUP TO REVIEW ADMINISTRATIVE PROCEDURE MEMORANDA (APM) APPLICABLE TO ALDERS (ended 5/2021),Member,Common Council Member,2019-09-03,2021-04-20
3944,44,DOWNTOWN COORDINATING COMMITTEE,Member,Common Council or Resident Member,2019-11-05,2023-04-18
3944,1325,COMMON COUNCIL EXECUTIVE COMMITTEE,Member,Common Council Member,2020-05-05,2022-04-19
3944,1353,PRESIDENT'S WORK GROUP TO REVIEW COUNCIL COMMUNICATION TOOLS & PROCESSES,Member,Common Council Member,2019-07-16,2020-06-18
3944,1365,PRESIDENT'S WORK GROUP TO REVIEW AND REVISE THE CHIEF OF STAFF POSITION DESCRIPTION (ended 10/2021),Member,Common Council Member,2021-01-04,2021-04-20
3944,41,COMMUNITY DEVELOPMENT BLOCK GRANT COMMITTEE,Member,Common Council Member,2021-04-20,2023-04-18
3944,236,MADISON AREA TRANSPORTATION PLANNING BOARD (MPO) (prior to 9/30/2023),Member,Elected Official,2021-04-20,2023-09-29
3944,1347,TRANSPORTATION POLICY AND PLANNING BOARD - ended 3/2023,Member,Common Council Member,2021-04-20,2023-04-18
3944,1348,TRANSPORTATION COMMISSION,Member,Transportation Policy & Planning Board Member (Alder),2021-04-20,2023-04-18
3944,1360,AD HOC TASK FORCE ON THE STRUCTURE OF CITY GOVERNMENT (TFOGS) FINAL REPORT IMPLEMENTATION WORK GROUP (ended 3-2023),Member,Common Council Executive Committee (CCEC) Alder,2021-05-04,2022-02-23
3944,1365,PRESIDENT'S WORK GROUP TO REVIEW AND REVISE THE CHIEF OF STAFF POSITION DESCRIPTION (ended 10/2021),Member,Common Council Member,2021-04-28,2021-10-22
3944,1368,"PRESIDENT'S WORK GROUP ON RACIAL JUSTICE, ANTIRACISM AND EQUITY (ended 5/2022)",Member,Common Council Member,2021-08-31,2022-04-19
3944,307,COMMUNITY DEVELOPMENT DIVISION CONFERENCE COMMITTEE,Member,CDBG Alder,2022-02-22,2023-04-18
3944,235,CAPITAL AREA REGIONAL PLANNING COMMISSION (CARPC),Member,Mayoral Appointee,2022-05-10,2025-04-01
3944,1326,PUBLIC MARKET DEVELOPMENT COMMITTEE (ended 1/2024),Member,Common Council Member,2023-04-18,2024-01-11
3944,1348,TRANSPORTATION COMMISSION,Member,Common Council Member,2023-06-20,2026-04-21
3944,1380,GREATER MADISON MPO (METROPOLITAN PLANNING ORGANIZATION),Member,Elected Official,2021-04-20,2026-04-30
3944,1325,COMMON COUNCIL EXECUTIVE COMMITTEE,Member,Common Council Member,2024-05-07,2025-04-15
3944,41,COMMUNITY DEVELOPMENT BLOCK GRANT COMMITTEE,Member,Common Council Member,2025-04-15,2026-04-21
3944,48,EQUAL OPPORTUNITIES COMMISSION,Member,Common Council or Resident Member,2025-04-15,2026-04-21
3945,42,COMMUNITY SERVICES COMMITTEE (ended 3/2025),Member,Common Council or Citizen Member,2015-04-21,2017-04-18
3945,294,MADISON FOOD POLICY COUNCIL,Member,Common Council Member,2015-04-21,2017-04-18
3945,284,MADISON LOCAL FOOD COMMITTEE (renamed Public Market Development Committee 12/2016),Member,Common Council Member,2015-04-21,2016-12-31
3945,303,SUSTAINABLE MADISON TRANSPORTATION MASTER PLAN OVERSIGHT COMMITTEE (Madison in Motion) (ended 2/2017),Member,Common Council Member,2015-04-21,2017-02-28
3945,307,COMMUNITY DEVELOPMENT DIVISION CONFERENCE COMMITTEE,Member,CSC Alder,2015-07-21,2017-04-18
3945,14,PUBLIC SAFETY REVIEW COMMITTEE,Member,Common Council Member,2016-05-17,2017-04-18
3945,1326,PUBLIC MARKET DEVELOPMENT COMMITTEE (ended 1/2024),Member,Common Council Member,2017-01-01,2019-02-06
